Date,final,likes,comments,url
2023-03-31 14:37:34,"AQUA, YONEX, TOYOTA, dan puluhan brand gede merapat ke VINDES. Apa rahasianya? dOnvo B2B Series BATE Sey aT PYST) Brent Zl & Sponsor Korporasi Prinsip B2B Marketing Marketing Funnel B2B Tutorial Milih Perusahaan sebagai Calon Partners atau Buyers Pitch & Proposal: Tutorial Bikin Proposal Kerjasama Organisasi Bisnis/Corporate Pitch & Proposal: Tutorial Pitching Kerjasama Organisasi Bisnis/Corporate (Offline door to door) Faktor yang Mempengaruhi Deal Proyek sama Corporate Mengukur dan Menjaga kinerja B2B marketing Problem-problem Saat Menjalankan B2B Marketing Awan Prasetyo Case study (Good & Fail) General Manager Vindes Co Harga PPT materi & video rekaman yang bisa diakses seumur hidup! SABTU, 01 APRIL 2023 PUKUL 13.00 - 15.00 WIB VINDES & 100+ partner-nya Se fool Deco ce] CW) eS Castiolf (3/2) me) Lenovo msi Panasonic BARD! traveloka 'p bukalapak @GCK Ofeawras by. Grob tket@com ew f OTT cmenoten ba acm Md 7 Cn etn head come OOM | aa ccd G@ Fsseconv enovo eI eon (a Ini bukan daftar belanjaan selama bulan Ramadan, tapi daftar perusahaan/brand/apapun namanya yang udah kerjasama sama VINDES. Kalo ngikutin event & social media VINDES, pasti ngertilah gimana biasanya mereka “ngiklanin” para sponsornya. Bukan cuma soal Vincent & Desta Nggak mau sok-sokan bodoh kalo kesuksesan VINDES bukan karena ketokohan Vincent & Desta. Tapi kayanya juga ga masuk akal kalo bilang mereka faktor satu-satunya. Neng bangun neng, suruh jualan malah pura-pura mati | od Sekarang coba diinget-inget, berapa banyak artis yang bahkan lebih terkenal, gagal pas eksekusi bisnis mereka? Padahal network ada, duit gede.. Terus apa dong? B2B Marketing in Vindes * Social Media Jaga kualitas, push marketing Mengulang yang seharusnya diulang: marketing paling pertama dari semua bisnis adalah produknya sendiri. Kalo produknya jelek emang percuma. Kebetulan produk VINDES nih ok semua, udah pas lah buat kategori entertainment. Tapi di samping produk, mereka juga punya banyak effort marketing. Kaya gini contohnye: @vwoas. Marketing E-newsletter Blast Press Release Media Day *diambil dari PPT Mas Awan buat materi gossip forum besok. Mulai dari brainstorm sampe financial projection Perusahaan kalo mau invest ke apapun, manapun, pasti cari yang kira-kira menguntungkan. Makanya kalo nawarin kerjasama, kita harus bisa punya skill bikin proposal sampe nego se-epic mungkin. At least ngerti dulu sama step-step ini: Avwors. Internal Process Brainstorming |»! Proposal *lagi-lagi diambil dari PPT Mas Awan buat gosip besok, detailnya bakal dijelasin di kelas. Media value & budget Yuyur aja, kalian yang masih baru-baru di B2B pasti agak bingung kan soal media value & budget ini? Mas Awan sih kasih spill kaya gini di PPT nya: Media Value *lagi-lagi spill materi. Ga keliatan yah? Ya namanya juga teknik marketing. Sengaja dibikin ga keliatan biar pada beli kelasnya Budget Nah ini perkara sensitif lain, budget. Apa aja yang kira-kira kudu masuk ke budgeting buat dimasukin ke proposal sponsor? Ini kata Mas Awan VINDES: e e e e e e Administration & Venue Production (Audio & Visual) Technical & Art Production Talent Manpower Miscellaneous / , 911 tolong temen sy pingsan grgr kecapekan scroll konten baru nemu 2 meme Report Biar hubungan manis tetep terjaga, perlu kita kasih report yang cakep. Menurut General Manager VINDES, komposisi report bisa kaya gini: Report PRE-EVENT PUBLISHED ARTICLE ANALYSIS PRES-CONF PUBLISHED ARTICLE ANALYSIS EY MESSAGE CoMPOSTION EY MESSAGE COMPOSTION Icon ics i FAC oeru ree weve, vn} [The 1s MAIN EVENT PUBLISHED ARTICLE ANALYSIS MEDIA PARTNER PUBLISHED ARTICLE ANALYSIS \GE COMPOSITION *waduh apatuh kok ketutup putih-putih? Kayanya kudu beli kelasnya sih biar tau isinya.. *masih usaha [Wihh ada spill rahasianya VINDES nih 🤫",5390,59.0,https://scontent-iad3-2.cdninstagram.com/v/t51.2885-15/338932698_6026352127402296_3352700991414916555_n.webp?stp=dst-jpg_e35&_nc_ht=scontent-iad3-2.cdninstagram.com&_nc_cat=100&_nc_ohc=ze0vjREBaIYAX9v2U9l&edm=APU89FABAAAA&ccb=7-5&oh=00_AfDR4xV5tf2Rp4Ue-ATe3L0sU2i9BjVdP5Ps8HSZaBuBvw&oe=647BE3EB&_nc_sid=f4eaf9
2023-03-30 12:50:26,"AOU Mota 3 kerjasama Adidas - Kanye West dengan kerugian sekitar 4 triliun dOnvo B2B Series BATE Sey aT PYST) Brent Zl & Sponsor Korporasi Prinsip B2B Marketing Marketing Funnel B2B Tutorial Milih Perusahaan sebagai Calon Partners atau Buyers Pitch & Proposal: Tutorial Bikin Proposal Kerjasama Organisasi Bisnis/Corporate Pitch & Proposal: Tutorial Pitching Kerjasama Organisasi Bisnis/Corporate (Offline door to door) Faktor yang Mempengaruhi Deal Proyek sama Corporate Mengukur dan Menjaga kinerja B2B marketing Problem-problem Saat Menjalankan B2B Marketing Awan Prasetyo Case study (Good & Fail) General Manager Vindes Co Harga PPT materi & video rekaman yang bisa diakses seumur hidup! SABTU, 01 APRIL 2023 PUKUL 13.00 - 15.00 WIB Ngebatalin kerjasama karena dirasa udah ga satu rasa value on w 8 I'ma bit sleepy tonight but when | wake up I'm going death con3_ On JEWISH PEOPLE The funny thing is | actually can’t be Anti Semitic because black people are actually Jew also You guys have toyed with me and tried to black ball anyone whoever opposes your agenda Source: The Jewish chronicle Akhir tahun 2022 brand Adidas ngebatalin kerjasamanya sama brand Yeezy, sebuah perusahaan design sepatu punyanya Mas Kanye West, rapper asal Amerika. Alasannya karena mas rapper satu ini bikin postingan yang dinilai rasis. Berpendapat di sosmed ini emang kudu ati-ati ya Yang Mulia :( Sedikit pengantar... Q } y Mencari tau kemana f | “larinya uang rakyat wy ee Se ee Jadi sejak tahun 2015, Adidas kerjasama dengan Yeezy Mafia. Nah, hasil dari kerjasama ini, Adidas bikin series produk yang namanya Yeezy. Saking lakunya produk ini di penjuru dunia, Minbi yakin kamu pernah ngeliat versi KW sepatu ini di jalan ataupun di pasar. Singkat cerita, karena Mas Kanye ini bikin masalah, lalu terjadilah apa yang sudah terjadi... Keputusan berat karena ngebatalin partnershipnya di Q4, soalnya lagi high season ADIDAS TERMINATES PARTNERSHIP WITH YE IMMEDIATELY = Herzogenaurach Dalam pengumuman resminya, Adidas menaksir ada kerugian ‘jangka pendek’ sekitar 250 juta euro, atau setara 4 triliun rupiah akibat pembatalan kerjasama bareng Mas Ye, nama lain dari Kanye West. Kata Adidas juga, ga mudah bagi mereka ngebatalin kerjasama ini, soalnya lagi di quartal 4 alias high seasonya orang jualan. You knowlah, ada momen 12.12 dan semacamnya.. Produk yeezy ini di tahun 2021 contributed sekitar 8% pemasukannya Adidas, setara 25 triliun rupiah. Uwow! = ww ry a FEATURED PRODUCTS Yeezy sempet viral dan laku parah. Data dari Business Insider memperkirakan produk ini berkontribusi sebesar $1,7 juta buat pemasukan Adidas pada 2021. Setara sama...jangan kaget yaa, 25 triliun rupiah :) Sekitar 8% dari revenuenya Adidas. Rasanya ngebatalin kerjasama kek gini pasti jauh lebih berat dari mutusin pacar yang udah sekian tahun bersama. Adidas pernah bilang, “is one of the most successful collaborations in our industry’s history” Selain viral, produk Yeezy ini juga datengin duit banyak, dan naikin brand valuenya Adidas secara drastis. Bahkan Adidas pernah statement kalo ini adalah kolaborasi brand terbaik mereka dalam sejarah. Tapi ya tapi, kalo partner kolaborasi kita udah berlawanan value rasanya agak susah dipertahankan ya bund ( Dari pemutusan eimta kerjasama, stop produksi, sampai pemberhentian pembayaran Noted, noted mulu lu tiap nelfon gue liat AG = _gDaripada elu, under UMR Ternyata akibat dari pemutusan kerjasama ini panjang juga pemirsahhh. Dalam pengumuman resminya, selain memberhentikan kerjasama bareng Ye, Adidas juga menstop semua produksi brand Yeezy, & tentu saja menghentikan semua pembayaran kepada Kanye West serta perusahaannya. Ngejaga perkataan di sosmed udah jelas, tapi ada hikmah lain dari kisah Adidas ini... x > ‘Sedikit demi sedikit, lama-lama kena inflasi Hikmah yang bisa diambil dari kisah kolaborasi brand Adidas & Ye ini adalah: kerjasama B2B bisa ngasilin cuan yang gede banget wkwkwk. Soalnya angkanya ga main-main, triliunan rupiah. Setidaknya kalo ada 2 brand lokal yang berkolaborasi at least nyentuh milyaran atau ratusan juta lah yaa.. [yang pake Yeezy siapa aja nihh?]",776,7.0,https://scontent-iad3-1.cdninstagram.com/v/t51.2885-15/338760527_798052278420158_7502636330317136276_n.webp?stp=dst-jpg_e35&_nc_ht=scontent-iad3-1.cdninstagram.com&_nc_cat=102&_nc_ohc=ueDnR4EnDeUAX-cq3Lf&edm=APU89FABAAAA&ccb=7-5&oh=00_AfCWediry2Tct_hLHgPX2knLUBQhI_gkM5PpqfByVGMo_Q&oe=647CD987&_nc_sid=f4eaf9
2023-03-29 12:05:46,"Data Forbes: 70% partnership bisnis GAGAL! Gimana biar Berhasil? donvbob YASS nT T ey ee Proyek & Sponsor Korporasi Prinsip B2B Marketing Marketing Funnel B2B Tutorial Milih Perusahaan sebagai Calon Partners atau Buyers Pitch & Proposal: Tutorial Bikin Proposal Kerjasama Organisasi Bisnis/Corporate Pitch & Proposal: Tutorial Pitching Kerjasama Organisasi Bisnis/Corporate (Offline door to door) Faktor yang Mempengaruhi Deal Proyek sama Corporate Mengukur dan Menjaga kinerja B2B marketing Problem-problem Saat Menjalankan B2B Marketing Awan Prasetyo Case study (Good & Fail) General Manager Vindes Co oe PPT materi & video rekaman yang bisa diakses seumur hidup! SABTU, 01 APRIL 2023 PUKUL 13.00 - 15.00 WIB Success partnership: sumber harta melimpah Makin besar suatu bisnis, biasanya bakal ada kebutuhan partneran sama brand lain. Soalnya menurut Forbes, partnership antar brand itu terbukti sama-sama nguntungin; nambah revenue, ngebuka opportunity baru, dan bisa ngasih ide baru yang inovatif untuk kedua belah pihak. Kekayaan Nike meningkat pesat karena sering kerjasama bareng artis atau atlet Yeezy Boost 350. Facebook/Adidas Yeezy Tahun 2019, penghasilan bersih Nike naik sampai 19.5% sampai nembus angka $1,9 billion, atau setara sama Rp. 28,6 triliun. Bukan penghasilan kotor yaa, tapi bersih. Ini hasil dari suksesnya partnership Nike bareng penyanyi rapp asal America, Kanye West. Ga cuma brand ke artis, tapi partnership antar brand gede juga sering terjadi Tita ts © spotity he ; y , Take the sound of Starbucks with you. et Starbucks pernah ngejalin partnership bareng Spotify. Alasan kerjasamanya karena Starbuck ngerasa coffe shop mereka ga pernah lepas dari yang namanya musik. Selain kopi, musik udah jadi jiwa mereka semenjak 40 tahun berdiri. Forbes bahkan memuji ini ada bentuk kerjasama yang jenius. The Spotify-Starbucks Partnership Is Digital Co-Branding Genius Nomi Prins Contributor I cover the business of media and entertainment Pas lagi ngeriset buat nulis konten ini, Minbi nemu artikel menarik di Forbes, judulnya Why Partnership Is Harder Than Marriage. ENTREPRENEURS Why Partnership Is Harder Than Marriage icle is more than 10 years old. x | ta Menurut data, angka gagalnya sebuah pernikahan alias perceraian itu di angka 50%, sedangkan angka kegagalan business partnership sekitar 80%. Sesuai judulnya, artikel ini ngejabarin alasan kenapa ngebangun partnership dalam bisnis itu Ssusahnya seperti menjaga hubungan pernikahan, bahkan lebih > #1 More money talk, always about money, ini yang jadi tantangannya Masih nungguin meme, kok baru 1 Kalo suka baca koran, kita bakal tahu kalo masalah uang jadi penyebab tingginya angka perceraian di negeri tercinta Indonesia. Partnership di bisnis juga gitu, di dalamnya ga cuma ngomongin pemakaian dana, tapi juga kejengkelan karena pencairan dana dari atasan yang ga kunjung dikasih buyer tanda tangan... 2# Kalo di bisnis, stakeholdernya lebih banyak i Mau bisa bikin konten Dalam rumah tangga, unsur yang terlibat intens paling cuma pasangan & anak. Tapi kalo udah kerjasama B2B bisnis, yang jadi stakeholder mungkin ga cuma bagian partnership perusahaan doang, tapi direktur, pegawai, client, dan lainnya juga terlibat. Meskipun katanya ‘susah’, tapi buktinya ada brand yang terkenal sering berhasil perihal kerjasama B2B ini aBVINDSS. Vindes Saker at Media Day Salah satunya VINDES. Pas banyak yang ngos-ngosan ngadain kerjasama antar brand, tim ini hepi terus keliatannya, dan eventnya selalu viral menggemparkan Indonesia. [cara biar partnershipmu berhasil 😌🤙]",367,0.0,https://scontent-iad3-1.cdninstagram.com/v/t51.2885-15/337921484_2138564129677905_8431639852167236302_n.jpg?stp=dst-jpg_e35_p1080x1080&_nc_ht=scontent-iad3-1.cdninstagram.com&_nc_cat=109&_nc_ohc=ykP9clCa6AwAX-zDUNK&edm=APU89FABAAAA&ccb=7-5&oh=00_AfADJ9cW76JSVUUUxswD1z7uPAnRPNdtUxLX4cdHQGyzPA&oe=647CB1D3&_nc_sid=f4eaf9
2023-03-28 13:22:34,"matte mPa MOL itl jadi event dengan budget paling gede di antara semua event FIFA World Cup. Buat apa aja? Onvo Marketing Series Tutorial Deal Proyek & Sponsor Korporasi Prinsip B2B Marketing Marketing Funnel B2B Tutorial Milih Perusahaan sebagai Calon Partners atau Buyers Pitch & Proposal: Tutorial Bikin Proposal Kerjasama Organisasi Bisnis/Corporate Pitch & Proposal: Tutorial Pitching Kerjasama Organisasi Bisnis/Corporate (Offline door to door) Faktor yang Mempengaruhi Deal Proyek sama Corporate Mengukur dan Menjaga kinerja B2B marketing Problem-problem Saat Menjalankan B2B Marketing Awan Prasetyo eet Na ene a Fil) General Manager Vindes Co oe PPT materi & video rekaman yang bisa diakses seumur hidup! SABTU, 01 APRIL 2023 PUKUL 13.00 - 15.00 WIB Tahun maren, dunia dibikin heboh sama event dari FIFA. Ga cuma akbar secara agenda, tapi kalo distalking lebih dalem, banyak banget kerjasama B2B di dalemnya™. Terlepas dari isu HAM selama pembangunan piala dunia, setidaknya perihal duit, kita bisa ambil sedikit hikmahnya. Revealed: 6,500 migrant workers have died in Qatar since World Cup awarded Guardian analysis indicates shocking figure over the past decade likely to be an underestimate What we know about the human cost of the 2022 World Cup Biar termotivasi untuk jadi orang proyekan yang sukses, MARKITADUDU (Mari kita stalking berapa duit-duitnya) *Sengaja dibold biar pada tahu kalo sabtu ini ada Gossip Forum B2B Marketing Data dari media DW bilang, FIFA World Cup 2022 ngabisin dana sebanyak $220 billion, Kalo dirupiahin jadi setara RP 3.300 triliun. Setara sama 2x lipat dana yang Pak Prabowo ajuin buat senjata militer, yaitu Rp 1.700 triliun. Kompas.com / News / Nasional Prabowo Tegaskan Tujuan Pengadaan Alutsista Rp 1.700 Triliun Bukan untuk Invasi Sementara, APBN Indonesia Indonesia tahun 2022 itu sebanyak Rp 2.600 triliun. Jadi, APBN kita satu tahun ternyata belum bisa nalangin duit proyek satu piala dunia. Gila-gilaan pasti fundingnya World Cup ini. Piala dunia dengan budget terbesar sepanjang sejarah umat manusia The most expensive World Cup ever tal cost of hosting recent FIFA World Cups {in $ billion)* Qatar a 220 Russia & [11.6 Brazil 2 His South Africa S) 93.6 Germany @ [§4.3 South Korea andjapan 2 [7 France | 23 United States & |0.5 *Includes spending on infrastructure projects. Values not adjusted for inflation - as of April 2022 eo Sepanjang sejarah FIFA, piala dunia Qatar ini budgetnya paling gede. Bahkan kalo digabungin sama 21 piala dunia sebelumnya, belum ngalahin budget yang 2022 ini. Karena ini adalah event umat manusia, jadi duit sponsornya ga cuma dari Qatar, tapi perusahan dari berbagai negara, mulai dari China sampai Amerika. Nah, sekarang mari kita lihat angka-angka perintilan yang Minbi dapetin dari Tim Investigasi Selimut Tetangga DNVB Bingung liat banyak’ _ ,angka di konten ini? Data dari Lembaga Statistica. e Event transport: $51 juta= Rp 765 miliar e Sistem ticketing: $41 juta= Rp. 615 miliar e Asuransi: $29 juta= Rp 435 miliar Nah, ini baru beberapa pengeluaran kecilnya. Kalo pengeluaran kecil kita biasanya cuma 2 ribuan buat bayar parkir, piala dunia biaya kecilnya udah level miliaran. B2B, cara cepat kaya dengan satu tanda tangan ie / =, 0 “sR I = OW mematikan fitur kemiskinan selama ramadhan Sa wiki 0 Salah satu kelebihan B2B adalah, kita cuma butuh satu (atau beberapa) tanda tangan dari stakeholder buat dapet duit dengan jumlah bejibun. Jadi asal bisa mainin relasi, duitnya bakal cepet dikasi. 3300 triliun rupiah ga bakal kKekumpul kalo cuma dari duit kas FIFA doang, tapi ada campur tangan sponsorhip dari berbagai brand gede dunia. Walau gak segede FIFA, Indonesia punya VINDES Liat apa. pin? Nah, tadi kita udah bahas event olahraga dunia yang diadain sama FIFA. Di Indonesia juga ada event olahraga keren, bedanya dengan balutan hiburan, yaitu sportainment. Keknya udah pada tahulah ya siapa otak dari event Tepok Bulu, Tiba Tiba Tenis, dan lainnya. *iya emang ga setara, tapi namanya juga jualan bang Ternyata VINDES ga cuma ngadain sportainment, tapi banyak event kreatif lainnya. Data dari PPT General Manager-nya Vindes, di tiap acara offline, mereka berhasil gaet kerjasama puluhan brand gede Indonesia. Jadi skill mereka ngejalanin B2B udah ga perlu diraguin. Source image: PPT Mas Awan, General Manager Vindes yang bakal ngisi Gossip Forum di hari sabtu ini [Ada yang nonton langsungg gaa? 🤩]",422,10.0,https://scontent-iad3-2.cdninstagram.com/v/t51.2885-15/337907033_704472221421684_7738246223563104224_n.jpg?stp=dst-jpg_e35_p1080x1080&_nc_ht=scontent-iad3-2.cdninstagram.com&_nc_cat=100&_nc_ohc=m48A9qW3aZgAX8E0G8E&edm=APU89FABAAAA&ccb=7-5&oh=00_AfBYy9tli2uttSljViLsbBG0GlXVxZaLwOX1b3nzZc_UcA&oe=647C2FB4&_nc_sid=f4eaf9
2023-03-27 13:00:00,"Strategi di balik #TebokBulu, #TibaTibaTenis dan event gila VINDES lainnya dOnvb Marketing Series Prinsip B2B Marketing Marketing Funnel B2B Tutorial Milih Perusahaan sebagai Calon Partners atau Buyers Pitch & Proposal: Tutorial Bikin Proposal Kerjasama Organisasi Bisnis/Corporate Pitch & Proposal: Tutorial Pitching Kerjasama Organisasi Bisnis/Corporate (Offline door to door) ) Faktor yang Mempengaruhi Deal Awan Prasetyo Proyek sama Corporate General Manager Vindes Mengukur dan Menjaga kinerja B2B marketing Problem-problem Saat Menjalankan B2B Marketing Case study (Good & Fail) SABTU, 01 APRIL 2023 PUKUL 13.00 - 15.00 WIB Berawal dari candaan Raffi Ahmad dan Vincent-Desta di sebuah podcast, eh malah beneran. Bahkan acaranya viral mampus:) L . - a @ - v es f | ry y- as ry VAT} aly Cs .. Cy ioe Indoor Senayar sii x i ee th A) Ini dia salah satu acara yang sempet bikin heboh jagad offline & online: Tiba Tiba Tenis. Kita coba ulik gimana VINDES jalanin creative event yang cuannya plus-plus > Kata General Manager Vindes Corp, Mas Awan Prasetyo, Tiba Tiba Tenis adalah agenda Vindes dengan partner B2B terbanyak sejauh ini Memmi mae a} sok yang mengawasi pe! sea in SAKER, agar supaya dapat diberjalankan dan dimelangkahkan dengan sebaik- au a ..yang jika terdapat kesalahan dari SAKER, maka sang direktur juga merasakan Vincent Ryan Rompies ert-petere, Direktur dari Vindes Company. Udahlah cakep, lucu, pak direktur lagi. Kacaw. Menurut info dari Pak RW yang jadi tim Investigasi Gossip Tetangga DNVB, acara Tiba Tiba Tenis menggaet sampai sebanyak 50an sponsor. Dan sponsornya ga kaleng-kaleng, mulai dari Toyota, Aqua, Chitato, Walls (ice cream kesukaan Tim DNVB), dan brand raksasa lainnya. Event-nya bercanda, manajemennya profesional Meskipun yang bertanding bukan atlet beneran (rata-rata artis yang hobi main tenis), tapi acara ini dikelola super serius. Bener-bener profesional. Marketingnya cuakep, tiket nonton livenya sold out itungan menit. Bahkan yang nonton live streaming di YouTube ada 700 ribuan. Tepok Bulu, even jenius cuan serius, Sampai bikin Mba Raisa rada kena pressure Raisa Andriana @ @raisa6690 Bertahun2 jadi fans badminton, baru semalem ngerasain di EA EAAin sama penonton. Dalam hati “Ohh gini rasanya jadi atlet” pressure bgt tapi seruuu Translate Tweet 8:49 AM - Jul 4, 2022 5,886 Retweets 588 Quotes 78.7K Likes 242 Bookmarks Acara yang digelar sama VINDES satu ini juga jadi perbincangan publik di tahun maren. Gimana ga rame, Desta, Vincent, Anya, Raisa, Hesti dan artis terkenal lainnya digabungin dalam satu frame. Mereka sendirian aja udah bisa bikin viral, apalagi ini digabungin dalam satu acara yang masih terbilang jarang di Indonesia: sportainment. Olahraga yang dibalut dengan hiburan. Si paling viral pada masanya BIER OK BUG iF2 \\ Karena seru, viral, dan keknya ga ada kontroversinya, acara ini dulu sempat jadi trending 1 Youtube. Waktu konten ini lagi dibikin, views siaran ulangnya udah sebanyak 14M views. Udah setara sama total warga DK] Jakarta + kota Bandung + one & only: Kabupaten Bantul. VINDES’ Creative Ecosystem Dalam rangka menghidupi dirinya sendiri, semua jalur marketing dilibas abis: Twitter, |G, YouTube, website & apps pun disikat. meme di konten ini cuma 1.4% Tapi beneran ini maujy ngundang GM- -ny Vindes?? Selain marketing, cara VINDES ngejalin kerjasama sama brand atau artis lain juga top. Kalo bahasa kerennya: B2B marketingnya jalan banget. There’s people behind numbers Jadi kalo ada perusahaan bagus, pasti ada tim keren di baliknya. Setelah diriset dengan sisa tenaga menjelang berbuka, VINDES ini isinya ternyata ga cuma Vincent-Desta, tapi tim di dalamnya juga keren. Biasanya disebut dengan Vindes Saker vindes.saker Following v Message +2 319 posts 43.6K followers 41 following Satuan Kerja VINDES LIVE 24 hari #RamadanBarengVindes Sahur Nih Yee 02.30 WIB | Bukber Nih Yee 17.00 WIB @vindes.ig @vindes.store @vdkate_ © partnership @vindes.id vindes.id kalo Vincent sebagai Direktur & Desta sebagai pemimpin yang jadi bos dari segala leader. Nah, dibawah mereka berdua ada seorang General Manager yang ngurusin segala hal, termasuk semua kerja sama dari VINDES — [belajar strategi B2B dari vindes 🤝]",8177,162.0,https://scontent-iad3-1.cdninstagram.com/v/t51.2885-15/327970216_930476814766237_6205561615692811553_n.jpg?stp=dst-jpg_e35_p1080x1080&_nc_ht=scontent-iad3-1.cdninstagram.com&_nc_cat=101&_nc_ohc=rv7dpccWMBAAX94y2NM&edm=APU89FABAAAA&ccb=7-5&oh=00_AfCx-2PZm8YlaBOCkGf0KbhsO52aNP0KUGqcE5pQ3JYC4Q&oe=647C4DE5&_nc_sid=f4eaf9
2023-03-24 14:34:19,"BLACKPINK bisa naikin sales luxury brand sampali ratusan % Pengaruh BLACKPINK in Your Area pada brand mewah dnvo Marketing Series Strategi KOL Marketing: Mulai dari Nyusun Target, Endorse + Ads, sampe Evaluasi Cara Menyusun Target & Strategi Syelete] alg KOL Marketing yang Efektif Cara Mengeksekusi KOL Marketing Dampak KOL Marketing pada Brand: Awareness, Desire, sampai Sales Kombinasi KOL dan Ads Marketing Monitor Efektifitas KOL on Marketing: dari Perencanaan f » 2 sampai Implementasi Teuku Mayoga e Review: Variabel yang Chief Marketing Officer Jiera Berpengaruh pada Strategi KOL Marketing Case study (Good & Eat ! >] p 159.000 Harga le: MINGGU, 26 MARET 2023 oO LINK ON BIO PUKUL 13.00 - 15.00 WIB Influencer marketing yang trendnya selalu berubah ———~ K ; Apapun perintah atasan, jawabnya tetap, “noted, noted” NG [Lai = Menurut Majalah Vogue Business, beberapa tahun terakhir terjadi pergeseran trend dalam per-influencer-an marketing, knususnya dari brand barang mewah. Yang biasanya pake artis-artis Hollywood form the west, sekarang mulai pake artis korea seperti anggota BTS & BLACKPINK. Hallyu Wave: gelombang naiknya budaya Korea ke kancah dunia Dengan ngendorse para artis global, brand mewah bisa promosiin produk mereka tanpa kerasa seperti iklan oleh audience. Selain itu, sejak adanya Hallyu Wave, artis-artis Korea udah jadi semacam Swiss Army of marketing, Karena reach mereka udah ga level lurah lagi, tapi mendunia. Teteh Jisoo yang makin melejitkan brand DIOR Sejak hari pertama pengumuman Teh Jisoo sebagai Brand Ambassadornya DIOR, follower & traffic media sosial brand ini naik drastis. Bahkan salesnya naik sampai 484%. Ini angka sales ya, bukan awareness. Produk + marketing yang cakep: harga naikpun pasar tetep mau beli yf q / | “Njih isoo insya : allah pak” Karena Teh Jisoo ini, jadinya anak muda 20an sampai 30an di Korea (tentunya bukan Korut) makin lebih milih DIOR sebagai pilihan fashion. Nah, momen ini dipake DIOR buat ngeboost profit dengan naikin harga sampai 5%. Kalo emang udah produk dan marketing cakep gini yaa, harga dinaikin aja masih rame yang mau beli:) Sebelum diangkat sebagai BA-nya, Mba Jennie emang udah lengket sama produk-produk Chanel. Bahkan sampai digelarin “Human Chanel” sama netizen. Source: Time Internatior Menurut Tim Investigasi K-POP (TikTop) DNVB, tahun 2020-2021 ada 27 postingan Jennie yang ngepromote produk Chanel. Menurut info dari pak RW yang anggota TikTop DNVB, endorsan Mba Jennie berhasil ngasilin cuan buat Chanel sebanyak 1,05 juta USD per postingan. Berawal dari foto bareng, nama produk sampai berubah jadi Lisa Bag Dipake Lisa keliatan mewah. Dipake istri pejabat jadi, “wah, duit dari mana nih?” Mba Lisa juga diendorse sama brand Celine. Saking “uwow’nya, produk yang nama aslinya Celine Triomphe Bag dinamai khalayak dengan Lisa bag. Soalnya Lisa pernah ngeposting foto pake tas ini. Ga berenti di situ, sejak postingan tadi, Lisa Bag ini sold out terus bahkan antrian next bacthnya sampe overload. Kontribusi Mba Burga Rose terhadap Brand Yves Saint Laurent (YSL) Rose Citra Lestari Source: Spotify Setelah Dik Rose jadi BA & ngepost di medsosnya, menurut TikTop DNVB, penjualan brand YSL naik sampai 343% di pasar Asia. Pasar Indonesia lebih fantastis lagi, naik sampai setinggi 1.168%. [ada yang blink ga di sini? 🫰]",1404,29.0,https://scontent-iad3-1.cdninstagram.com/v/t51.2885-15/337348435_256505326730617_6364646302272832862_n.jpg?stp=dst-jpg_e35_p1080x1080&_nc_ht=scontent-iad3-1.cdninstagram.com&_nc_cat=101&_nc_ohc=QFI3d_BzekwAX9EQcI0&edm=APU89FABAAAA&ccb=7-5&oh=00_AfALwAg-5ECpIpqaitzvRGhXJWiCpNeHxtaCQaGIytwa5Q&oe=647C1DB8&_nc_sid=f4eaf9
