Date,final,likes,comments,url
2023-01-27 12:13:40,"Forbes bilang: 70% orang tertarik sama brand yang campaignya punya “value” NPURE dan campaign-nya yang selalu “mencerdaskan kehidupan bangsa’ dnvbob DNVB Marketing Festival / Effective Marketing Campaign: Cara Bikin Customer Mau Beli Tanpa Skip How to Create Effective Marketing Campaign: dari Ide, Persiapan, sampai Implementasi Faktor-faktor yang Mendukung Marketing Campaign kita Sukses Marketing Campaign dengan KOL di Beberapa Platform Media Sosial How to Minimize the Risk: Identifikasi Beberapa Problem saat Marketing Campaign Lesson Learn: Beberapa Metrik Keberhasilan Marketing Campaign Case study: Good & Fail MINGGU, 29 JANUARI 2023 PUKUL 13.00 - 15.00 WIB ey Devina Wijaya Chief Marketing Officer NPURE Harga ‘m) LINK ON BIO Emosinya di-set dulu bosq ampaig ommunicatio dnvod NPURE Biar value campaign bisa tersampaikan dengan smooth, kita kudu nge-define dulu emosi yang mau dibawain: takut, sedih, bangga, bahagia, prank, atau _yan lain. Jangan asal aja, soalnya kalo asal-asalan nanti kayak nasib hidupmu yang ga jelas arahnya:( *PPT-nya Mba Devina keren parahhh ges Marketing = proses jalan penyampaian nilai ’ : : \lya susahnya bareng | /\ gue senengnya Janji yaa susah seneng bareng2 wl bareng pacarmu yg / gak seberapa itu | ™ 4 MT Ada yang lebih penting dari sekadar jualan, yaitu nyampaiin value kita ke market. Pernah ga ngerasa ‘eneg’ ke temen yang tiap ketemu kerjaannya selalu nawarin jualan? Biasanya kita lebih ikhlas check out ke kenalan yang di mata kita punya value WOW. Success campaign: strong value! Ni orang gaji UMR (WSJogja ngepet _ dimana kok bisa punya duit buat \ \Siilburan), Riset dari Porter Novelli bilang, 78% orang bakal lebih ingat sama brand yang punya strong value.. Hidup gitu juga, kalo ga punya value bakal gampang dilupain sama orang-orang. Semua bakal lupa sama kamu kecuali debt collector. Layaknya life, campaign juga kudu dimonitoring How to create marketing campaign? based on personal experiences ya! e Back to your KPI - Social Media/ E-Commerce Analysis (Engagement Measure & Rate. Traffic) analyze your ee CTD reo tN a dnvb WPURE Menurut CMO-nya NPURE, ada beberapa KPI buat nilai suatu Campaign sukses atau engga: mulai dari social media/e-commerce analysis, CTR (click through rate), ROI (Return on Invesment), & repeat order selama 3-6 bulan. Matriks campaign itu ga harus selalu yang bisa dihitung dengan angka. hy 2 si Hasil nendang pintu aj flexingnya udh kaya bos djarum Ada beberapa capaian non-angka yang nandain campaign kita itu berhasil atau engga: 1. Makin banyak yang tahu sama kita 2. Mngangement sama pasar naik, kayak koment atau DM di IG 3. Image brand kita makin positif Campaign via KOL: banyak yang nyoba, sayangnya rawan boncos TM tuk dibobo Kebanyakan brand gagal melakukan campaign via KOL itu karena briefnya salah.. IG & Twitter kudu diperlakuin secara beda. Begitu juga TikTok. Briefnya ga bisa asal tembak disamain aja. Sedang PDKT orang aja caranya kudu beda, apalagi KOL. Rukun campaign: selalu cek budget, hati-hati boncos How to create marketing campaign? based on personal experiences ya! Simulations: Check your objectives & budget Lounching Day After Launching 30% lt dnvb NPURE Ga ada teori yang fix dalam marketing. Tapi kalau mengacu ke NPURE, mereka selalu ngeset hukum 20-30-50 dalam ngatur budget campaign: 20% buat pre-launching, 30% buat launching day, & 50% buat after launching. [ga mau kann cepet dilupain orang? 😪]",2214,33.0,https://scontent-iad3-1.cdninstagram.com/v/t51.2885-15/327360861_151292147705936_1492274111984831888_n.webp?stp=dst-jpg_e35_p1080x1080&_nc_ht=scontent-iad3-1.cdninstagram.com&_nc_cat=108&_nc_ohc=WLTuvGaRRa4AX8o3VA3&edm=APU89FABAAAA&ccb=7-5&oh=00_AfCX0alyjK_evrl1g8-KSaLUf2OYW3Ju8K3EXKKH3xSXQg&oe=647B6168&_nc_sid=f4eaf9
2023-01-26 12:18:50,"Cara NPURE ngejual ratusan ribu pcs lewat campaign, 7-10% budget marketing, & pesan penting di balik #GenerasiKulitSehat dnvo DNVB Marketing Festival _ Effective Marketing | Campaign: Cara Bikin Customer Mau Beli Tanpa Skip How to Create Effective Marketing Campaign: dari Ide, Persiapan, sampai Implementasi Faktor-faktor yang Mendukung Marketing Campaign Kita Sukses Marketing Campaign dengan KOL di Beberapa Platform Media Sosial How to Minimize the Risk: Identifikasi Beberapa Problem saat Marketing Campaign Lesson Learn: Beberapa Metrik Keberhasilan Marketing Campaign Case study: Good & Fail MINGGU, 29 JANUARI 2023 PUKUL 13.00 - 15.00 WIB = Ml Devina Wijaya Chief Marketing Officer NPURE Harga ‘an) LINK ON BIO Cara tampil ke permukaan di tengah persaingan bisnis skin care yang bikin ngos-ngosan Gue muda, Founder, -CEO, bisnis gue e omsetny ratusan jutal - ff \ G Brand NPURE bisa muncul ke permukaan ga cuma bermodal promosi yang bombastis. Brand lokal satu ini bisa menarik atensi publik lewat campaignnya yang selalu educated dan bikin rame di jagad maya. Puluhan sampai ratusan ribu produk pernah ludes terjual lewat beberapa campaign marketing Kamu kan yang bikin kita batal deal sama client yang maren fa i"" ( J» Sengaja bu. Dia soalnya 227 2 mantan yg dulu bilang ga A, N bisa idup tanpa sy, eh malah “sukses kaya raya yan Ada 3 campaign tersukses yang pernah dijalanin sama NPURE: e #ExfoWithFear: 45 ribuan produk e #BeatTheSun: 35 ribuan produk e #EkspektasiVSReality: 130 ribuan produk Syarat utama campaign sukses: out of the box! a hl f Papa jangan mau terus “dibego-begoin sama atasan di kantor ya Atasan papa kan mama kamu nak EE = '\: Kata CMO-nya NPURE, kunci US sukses campaign mereka adalah: cari WOW faktor yang bisa bedain kita dengan yang lain, eksekusi yang mateng di semua divisi, dan “eval, eval, evall”. Message campaign bagus itu yang bisa ngasih value dan pesan yang anti mainstream Li Salah satu campaign NPURE yang lagi jalan sekarang adalah #GenerasiKulitSehat. Campaign ini ngebawa pesan kalo ngerawat kulit itu bukan buat bikin kulit jadi putih, tapi buat dapet kulit sehat. Jadi sekarang benerin niatnya yah kalo mau skincare-an. Ganteng ga harus seputih Song Jong-Ki kok :) #LuruskanNiat #GenerasiKulitSehat versus stereotype masyarakat Dah tahu info terbaru? /Abis slide ini figa ada memey Blagi Ga sedikit yang nanya ke NPURE, “kak kalo mau putih pakai produk apa ya?”. Padahal ya goals ngerawat kulit bukan itu. That's why #GenerasiKulitSehat ini lahir. The growest platform for marketing Bonus Materi! Apakah kamu sudah memanfaatkan platform Tiktok secara maksimal? dnvb PURE TikTok jangan cuma dipake buat nonton potongan quote Fajar Sad Boy. Sebagai platform yang grownya paling bombastis, sayang banget kalo kamu ga make platform ini. Bahkan NPURE makai TikTok buat ngejalanin campagin marketingnya, mulai dari hashtag challenge, organic & ads content, sampai live 24 jam. Kalo kata Wiz Khalifa, “/t’s been a long day..”. Campaign marketing juga begitu ideal preparation 2-3 month (only for marketing, but not mandatory) pms Perel gre Mier) (BL a [ieee era et ented Concepting Production — iia 2 weeks 1 weeks 1-45 2 weeks 2 weeks Tweeks 1-3 month months dnvo NPURE Bikin campaign marketing itu ga sekali bikin video atau poster terus boost dan udahan. Tapi ada timeline panjang yang kudu ditempuh. Kalo tadi malem dimulai besok udah kelar, itumah Rapat Undang-Undang. Xixixi. #Takut [biar ga boncos terus niii]",1034,20.0,https://scontent-iad3-2.cdninstagram.com/v/t51.2885-15/327488508_722392869275568_436231101988413376_n.webp?stp=dst-jpg_e35_p1080x1080&_nc_ht=scontent-iad3-2.cdninstagram.com&_nc_cat=100&_nc_ohc=PaDaU2QcieMAX-4ZgxX&edm=APU89FABAAAA&ccb=7-5&oh=00_AfBq8JIqNk9OcEzYD6XauSvUtoiMIw7RRmFMZRrc6_RMVw&oe=647D22D5&_nc_sid=f4eaf9
2023-01-25 15:22:46,"Campaign brand sabun cuci yang berhasil ngubah mindset satu negara dOnvbob DNVB Marketing Festival ie Effective Marketing Campaign: Cara Bikin Customer Mau Beli Tanpa Skip How to Create Effective Marketing Campaign: dari Ide, Persiapan, sampai Implementasi Faktor-faktor yang Mendukung Marketing Campaign Kita Sukses Marketing Campaign dengan KOL di Beberapa Platform Media Sosial How to Minimize the Risk: Identifikasi Beberapa Problem saat Marketing Campaign Lesson Learn: Beberapa Metrik Keberhasilan Marketing Campaign Case study: Good & Fail MINGGU, 29 JANUARI 2023 PUKUL 13.00 - 15.00 WIB ee | Devina Wijaya Chief Marketing Officer NPURE Harga ‘ms ) LINK ON BIO Kisah ayah & anak perempuan Alkisah di sebuah campaign.. seorang ayah yang lagi jenguk anak perempuannya. Si Ayah tertegun melihat anak perempuannya yang mengerjakan banyak hal: nyuapin anak makan, bikinin kopi suami, nyuci baju, sembari telfonan sama temen kantornya. Si ayah dan rasa bersalahnya ‘\ | Kalo ini bridging buat minjem duit lagi gue } | Ww lu | LA Sementara si anak perempuannya ngerjain semua hal di rumah, sang suami cuma baca koran sambil nonton TV di sofa. Si ayah merasa bersalah, karena dia ngerasa ini adalah gambaran masa lalunya. la dulu selalu membiarkan istrinya buat ngerjain semua hal sementara si ayah adalah “raja” di rumah. Tidak ada kata terlambat untuk berubah ere &) Maju lu gue ga takut gue eles Allah | > = | a Ketika oulang, si ayah singoalin surat permintaan maaf ke anak perempuannya atas teladan buruknya di masa lalu. Sesampai di rumah, sang ayah langsung bertekad untuk berubah. Dalam hati dia berujar, “Kalo ga bisa bantuin dapur, setidaknya saya bisa ngurusin pakaian kotor sendiri’.   Campaign ini viral mampus di India. Bahkan pengaruhnya juga nyampe di Pakistan, Bangladesh, & Sri Lanka Sebelum campaign ini di-launch, 79% laki-laki di India mikir kalo kerjaan rumahan adalah jobnya perempuan, sementara kerjaan outdoor adalah bagian kaum lelaki. Tahun 2016 angka ini turun menjadi 63%, dan di tahun 2018 tinggal 52% lelaki India yang mikir kalo kerjaan rumah adalah kerjaan perempuan. Dinotice sama COO Facebook CA) Seer ns eee Why is laundr mother’s job? Dads #ShareTheLoad This is one of the most powerful videos | have ever seen — showing how stereotypes hurt all of us and are passed from generation to generation When little girls and boys play house they model their parents’ behavior. this doesn't just impact their childhood games, it shapes their long-term dreams. In this #SharetheLoad campaign, Ariel India, P&G, and BBDO Worldwide show how fathers and husbands can take small steps (like doing laundry) to create more equal homes. They won a ... See more sh 158K @ 8.5K am 312K Saking viralnya, Sheryl Sandberg COO-nya Facebook ikutan ngerepost video campaign ini di akun pribadinya. [bukan kampanye yang itu yaa~]",3040,36.0,https://scontent-iad3-1.cdninstagram.com/v/t51.2885-15/327332843_1512286219265020_6780887177933974286_n.webp?stp=dst-jpg_e35_p1080x1080&_nc_ht=scontent-iad3-1.cdninstagram.com&_nc_cat=104&_nc_ohc=zIoWDbYt3zoAX-COlD5&edm=APU89FABAAAA&ccb=7-5&oh=00_AfCdkBgObppaPrBExNuWYBLgh1xPiL_08zGzVAl2spx06w&oe=647C5A08&_nc_sid=f4eaf9
2023-01-24 13:37:40,"Gimana NPURE bisa ngejual 130 ribu pcs produk lewat campaign? A Story... Onvb DNVB Marketing Festival / Effective Marketing Campaign: Cara Bikin Customer Mau Beli Tanpa Skip How to Create Effective Marketing Campaign: dari Ide, Persiapan, sampai Implementasi Faktor-faktor yang Mendukung Marketing Campaign Kita Sukses Marketing Campaign dengan KOL di Beberapa Platform Media Sosial How to Minimize the Risk: Identifikasi Beberapa Problem saat Marketing Campaign Lesson Learn: Beberapa Metrik Keberhasilan Marketing Campaign Case study: Good & Fail MINGGU, 29 JANUARI 2023 PUKUL 13.00 - 15.00 WIB 27 | ae : yet aT WIEN) Chief Marketing Officer NPURE Harga (ma) LINK ON BIO Ga tahu sadar apa engga, Pernah ga sih kamu nitip beli air mineral ke temen, terus bilang, “Eh gue nitip Aqua satu yaa”. Padahal Aqua bukan satu-satunya merek air minum loh, tapi hanya salah satu brand air minum kemasan di Indonesia. ltu bukti kalo Campaign dari brand Aqua berhasil & tertanam di benak kita. Dari Harvard Business Review yang Minbi baca, cuma 11% orang yang ingat sama campaign yang isinya ketawa-ketiwi, dan hanya 20% yang lekat di memorinya tentang campaign yang nakut-nakutin. Inmet pas ee WY (weekend ay ; Jadi yang jadi highlight utama kita kalo bikin campaign adalah value dan faktanya, bukan sekadar hahahihi atau serem-seremannya. Campaign yang sukses adalah yang “no boong-boongan” \ ae i) / iM J UMR Jogja /_ (aja sombong= | Elu gaji underpaid sok-sokan nyicil Ge!phone 14 How | Riset dari University of Pennsylvania membuktikan kalo sebuah kampanye “anti-rokok” yang menguraikan fakta-fakta tentang bahaya rokok, bisa menstimulasi bagian otak yang mengubah perilaku. Jadi campaign yang beginian bisa lebih ngefek ketimbang campaign yang isinya propaganda ngadi-ngadi. Artikel yang berjudul, The Elements of an Effective Cause Marketing Campaign bilang: i iF /Es “The Gun” mM SBE Campaign yang sukses biasanya selalu mengandung salah satu dari lima unsur ini: 1. i & Go fo Simple dan pesan yang menginspiresyion Visual storytelling yang oke Ada elemen fisik yang bisa dilihat Pake beberapa channel media Ngebawa isu besar & ada ajakan aksi kecil Marketing campaign ga cuma tentang rame-ramean, tapi kudu ada goals sejak awal Dikutip dari Investopedia, ada beberapa goals yang bisa dicapai dari ngelakuin campaign: ngebangun brand image, ngenalin product baru ke market, naikin sales, bahkan bisa untuk ngecounter isu negatif tentang brand kita. Hmmm, menurut kamu ada lagi ga goals lain dari ngadai campaign? Campaign rame ala NPURE Hei kamu/ — ~rajin lari yaa Brand Skincare asal Indonesia, NPURE terbukti pernah ngadain campaign yang cukup rame di jagat maya. Campaign NPURE tentang #exfowithoutfear terbukti udah ngasilin 13 juta views di TikTok. Bahkan campaign #beatthesun bisa mencapai 71 juta views. Ngelawan stereotip tentang skincare-an Npure pernah ngadain campaign dengan tema “Ekspektasi versus Realita’. Isi pesannya adalah ngasih tahu sebenarnya tujuan ber-skin care itu apa sih. Skincare-an ga bertujuan buat jadi cantik kayak orang lain, tapi jadi just be your self. campaign ini berhasil bikin NPURE ngejual produknya sebanyak 130 ribu. [yok disikatt~]",1838,42.0,https://scontent-iad3-2.cdninstagram.com/v/t51.2885-15/326883544_1300139430562302_2939183612326721225_n.jpg?stp=dst-jpg_e35_p1080x1080&_nc_ht=scontent-iad3-2.cdninstagram.com&_nc_cat=106&_nc_ohc=fOBxS3GPeS0AX8_Ga_X&edm=APU89FABAAAA&ccb=7-5&oh=00_AfAsouMkca-xb5VdryloyBi5UbfZiHuqfrDPLwrOhr63YQ&oe=647B6338&_nc_sid=f4eaf9
2023-01-20 12:46:12,"86% Orang Bilang Bakal Mau Ngeluarin Duit Buat Belanja Kalo Customer SY =1 A(T a Nc CL a Sayangnya, cuma 30% bisnis yang aware sama ini Onvbo DNVB Marketing Festival Customer-relationship Management: A to Z Bikin Customer Loyal sama Brand Kita e« Customer-relationship Management: A to Z bikin customer setia sama brand kita e Impact customer-relationship management ke brand kita: sales, repeat order, & efisiensi budget marketing See e Cara optimasi teknologi & ps) data buat naikin / |e oo customer-relationship hone adrah Rafidah * Masalah yang bikin Marketing Director of HMNS customer-relationship kita jadi jelek e Case study: Case yang gagal & berhasil Harga SABTU, 21 JANUARI 2023 ea PUKUL 13.00 - 15.00 WIB ed Bisnis itu ga cuma tentang “gue jual lu beli”, tapi tentang membina hubungan yang langgeng sama.. focus on the transaction, not relationship. Kebanyakan orang berbisnis cuma fokus gimana cara produknya kejual. Padahal kalo mau kaya raya kayak tadrat<enz Raffi Anmad, kudu ngebangun bisnis yang bisa langgeng hubungannya sama customer. Customer relationship management adalah Investasi yang penting bin utama dalam bisnis - i Suka, cuma alangkah A paints belinya jangan ,y \pake duitku 1 terus \ Laporan dari New Voice Media Tahun 2018 bilang, 67% orang bakal terus gonta ganti produk sampai nemu brand yang customer relationnya seru. Makanya kalo udah punya customer itu disayang ya ges, nanti kalo dia pindah ke lain hati baru nangis kamu:( Kenapa ga semua customer bisa diperlakukan sama? Happy weekend sayang j Bf \ = e Kalendrku isinya senin semua sayang 1 1 72% orang hanya bakal mau belli suatu promosi yang isinya personalized. Ada yang senengnya disayang, ada yang sukanya diajak ngobrol, ada yang prefer dijawab singkat padat jelas, ada yang suka tapi gak disuka balik :(. So, jadi admin/CS kudu sepinter itu ngenalin karakter customer & kudu tau cara handlenya. 5 hal yang kudu diperhatiin ~ Kamu cantik kalo senyumnya kayak gituh~ = Menurut Forbes, ada 5 alasan customer milih ganti brand: 1. Ngerasa ga diapresiasi 2. Bagian customer relationnya ga bisa menjawab sampai 3 pertanyaan dari customer 3. Pegawainya ada yang nyebelin 4. Customer dipindah-pindahin urusannya, kayak ngurus KTP 5. Customer nunggu antrian lama dengan alasan yang ga jelas Kabar baik, y S Weekend mau minjem duit siapa lagi ya buat Menurut data dari Tim Pencari Orarg Hitaag Data DNVB, kalau brand bisa ngejaga hubungan baik sama customer, 66% mereka bakal loyal, 65% bakal ngasih rekomendasi ke kenalannya, & 48% bakal mau spend money buat belanja lagi. Tapi kabar buruknya adalah, Mah plis, satu kali ini jaa Ga bisa, kamu udah beli’ 10 lato-lato dim 1 hari. \ \Mau | jd reseller di usiamu_ \ yg masih TK ini? eee eo Sebaliknya, customer yang ngerasain customer relation yang jelek, 39% mereka ga mau pakai brand yang sama lagi. Bahkan 36% bilang mereka bakal langsung ngirim komplain ke brand. Minimal kasih rating jelek di Google. Persaingan makin ketat bestie :) itu yang jelek siapa kak? Berdasarkan survey tahun 2020 dari Deloitte, dalam 3 tahun terakhir brand-brand di dunia udah mulai agak aware buat investasi di customer experiencenya. Jadi persaingan rebut-rebutan hati customer makin sengit nihhh ges. [tips langgeng sama pacar (read: customer) 🤣]",3841,47.0,https://scontent-iad3-1.cdninstagram.com/v/t51.2885-15/325996005_707277191110820_2715706296754092882_n.jpg?stp=dst-jpg_e35_p1080x1080&_nc_ht=scontent-iad3-1.cdninstagram.com&_nc_cat=108&_nc_ohc=V-swc9YPjp8AX-vgSJw&edm=APU89FABAAAA&ccb=7-5&oh=00_AfA3J5q0PRQwnHqCPN947MCHmG99Czcbe_ByY8DqXwLFww&oe=647BDC2A&_nc_sid=f4eaf9
2023-01-19 13:40:39,"One Day Customer: teknik “pendekatan diri’ ke customer yang bikin DM & sales HMNS rame walaupun gak ada konten! Apaan tuh? dOnvbo DNVB Marketing Festival Customer-relationship Management: A to Z Bikin Customer Loyal sama Brand Kita « Customer-relationship Management: A to Z bikin customer setia sama brand kita ¢ Impact customer-relationship management ke brand kita: sales, repeat order, & efisiensi budget marketing ¢ Cara optimasi teknologi & data buat naikin - : (dad customer-relationship Jihan Amirah Rafidah * Masalah yang bikin Markerinaleitestone ANNs customer-relationship kita Harga jadi jelek « Case study: Case yang gagal & berhasil SABTU, 21 JANUARI 2023 PUKUL 13.00 - 15.00 WIB Customer relationship yang bagus bisa jadi solusi buat ‘silaturahmi ya Mba Jihan, Marketing Director of HUNS bilang, biasanya mereka nyiapin budget 10% buat marketing. Tapi karena mereka punya customer relationship yang bagus, budget marketing HMNS bisa ditekan lebih rendah dari 10% tadi. Soalnya bikin customer jatuh hati sama brand bisa nyiptain word of mouth di pasar Capek-capek lembur, dibayarnya pake minyak kemiri biar rambut gak botak Customer yang loyal bakal jadi agen word of mouth sebuah brand. Jangan heran kalo di arisan ibu-ibu biasanya ada satu orang yang bersemangat ‘45 buat ngejelasin barang yang lagi dia pake, terus ngajakin ibu-ibu lain buat beli juga. Belanja karena kena racun dari kenalan Tahu ga makanan yang sering teraniaya?=> Forbes bilang, rekomendasi temen atau sanak famili merupakan alasan terbesar kebanyakan orang terdorong buat belanja. Ini belanja yang ikhlas ya, bukan belanja karena kasian liat temen danusan. Jagalah hati = terntera-hidupni peluang sales meningkat Syarat kerja di sini apa pak?, Bisa bekerja di bawah tekanan. Pantang pulang Salah satu artikel HBR bilang, “perasaaan para customer ke brand sangat berpengaruh besar ke sales”. Biar makin kebayang gimana cara naikin sales dengan cara ngebangun hubungan baik sama customer, mari kita intip cara HMNS ngelakuinnya> #1 Storytelling sebagai senjata utama Baa» ia ng (~ A - Gaji boleh UMR Jogja, tapi shopping tetep _ UMR Jakarta © HMNS selalu bisa bikin storytelling yang apik ke para customernya. Prinsip always make customer the hero of the story bikin konten dan promosi HMNS rame terus. #2 One Day CR: semua tim dapet jatah jadi customer relation Kapan ya aku upload foto pake caption: capek-capek kerja ternyata E bapak ku yang punya Tesla One Day CR adalah program yang diadain HMNS buat semua staffnya. Dimana mereka gantian ngehandle customer. Kata Mba Jihan, tujuannya buat bikin semua tim dari berbagai divisi bisa bekerja berdasarkan kepuasan customer. #3 Deeper relationship—more share stories— stronger brand soul im Gajian masih tgl 25 tapi duit tinggal) cukup buat beli obat mag Saking seneng sama brandnya, banyak customer HMNS yang suka ngebagiin pengalamannya di media sosial. Cerita para customer ini biasanya dijadiin ide story, konten, atau bentukan lainnya buat naikin value brand HMNS di media sosial. [Udah chattingan sama customer hari ini?]",1786,51.0,https://scontent-iad3-2.cdninstagram.com/v/t51.2885-15/326128166_168894202530869_1930797844615973336_n.webp?stp=dst-jpg_e35&_nc_ht=scontent-iad3-2.cdninstagram.com&_nc_cat=105&_nc_ohc=41bJJ-rsDAgAX_A81pL&edm=APU89FABAAAA&ccb=7-5&oh=00_AfBHmgcpLczOs3uW0X6gUwe8YxXfAPB0FLk6P6VUiJzhxQ&oe=647BCD22&_nc_sid=f4eaf9
2023-01-18 13:46:40,"Gimana cara Netflix dapetin repeat order sampai angka 93%? Here's the story.. Onvb DNVB Marketing Festival Customer-relationship Management: A to Z Bikin Customer Loyal sama Brand Kita Customer-relationship Management: A to Z bikin customer setia sama brand kita Impact customer-relationship management ke brand kita: sales, repeat order, & efisiensi budget marketing Cara optimasi teknologi & data buat naikin Jihan Amirah Rafidah customer-relationship da Masalah yang bikin Marke ng iectenon ine customer-relationship kita Harga jadi jelek Case study: BD 150 00 Case yang gagal & berhasil SABTU, 21 JANUARI 2023 PUKUL 13.00 - 15.00 WIB Sadar ga sih, dari film Netflix yang sama, kamu & temenmu bisa dapet trailer yang berbeda? Malem2 gini palingll enak emang nnton etron > <= a tp ngga nnton sin azab gini juga — | — Pas lagi bikin konten ini, Minbi coba make sure dengan minta temen buka trailer drakor The Glory. Dan ternyata bener, kami dapat trailer yang beda. Kira-kira tau ga kenapa Netflix bisa ngasih perlakuan yang beda ke setiap customernya? Jawabannya: data. Data for customer relationship management Sales kita minggu ini aman? man bos, tim sales udah mulai live mandi lumpur di TikTok Buat ngejaga ikatan batinnya sama customer, Netflix pake data buat cari tau; apa yang ditonton, kapan aja nontonnya ake device apa, ngasih rating berapa sampai tau si customer ngepause berapa kali pas nonton suatu film atau serial. Pake data buat ngasih rekomendasi produk dik Sogokan buat bocah2 gy |S sbiar kalo main lato2 Sees: dilepas 1 civil Data tadi dipakai NetIfix buat ngasih rekomendasi produk. Si customer ini sukanya genre apa, aktor siapa. Dengan kaya gitu, Netflix bisa tahu kita itu sukanya kisah cinta yang berat-berat kayak The World of the Married, atau yang ringan tanpa beban cicilan rumah tangga kayak Home Town Cha-Cha-Cha. Ini yang bikin banyak orang betah nonton Netflix & subscribe, karena kalo udah keabisan list tontonan, rekomendasi Netflix selalu relate Perasaan maren harga diri gue simpen di sini deh, kok ga nemu ~ ea ‘wiki Dalam hati kita kayak bilang, “wow, dia kok tahu sih apa yang gue mau?”.. Ini berlaku di semua bisnis. Customer bakal loyal sama brand yang bisa peka sama keinginan mereka, alias_belum dibilangin tapi udah paham duluan. Apakah produk non-digital juga bisa main data? Kenapa cicak diam2 merayap?_ Karena kao diem2 dighibahin temen itu kita stn —\ Tentu saja bisa bosq! HMNS Perfumery pake data buat bikin customernya makin sayang. Data dianalisis & dipake buat lebin tau customer mana yang butuh belaian kasih sayang & mana yang butuh dikeacangit dikirimin hadiah. Data — perlakuan spesial— loyal sama ada-band brand a =~.Selamat datang di k ___kami. Keluhannya HMNS ngelakuin inik apa? ‘“\ minggu, kadang malah nyuruh_ NY anterin anaknya sekolah = Via = eet 7 cara yang berbeda buat ngejaga hubungan sama customernya: ada yang dikasih info tentang launch produk baru, undangan ke secret event, sampai ada yang dikasih Pandora Box. Feedback— data — business decision eo ava Astaghfirullah haladzim cicilan pay later mengejar di belakang Di HMNS, data-data feedback dari customer ga cuma dibiarin nganggur, tapi biasanya diolah lagi buat ngeliat: 1. 2. 3. aos Produk mana yang mau diimprove Produk yang lagi dipengen sama orang-orang Konten & campaign kek mana yang mau dibikin Cara brand HMNS kudu bersikap dan masih buanyak lagii... [semua pake data ternyataa 🤔]",1307,22.0,https://scontent-iad3-2.cdninstagram.com/v/t51.2885-15/326305622_153718887461633_917451418446941583_n.webp?stp=dst-jpg_e35_p1080x1080&_nc_ht=scontent-iad3-2.cdninstagram.com&_nc_cat=105&_nc_ohc=wcrgmT-1mHQAX9gFtdG&edm=APU89FABAAAA&ccb=7-5&oh=00_AfAuhtNWQqM7keXofQ2d5tvZvGbHYi5S-vLXehPR1U1_Xg&oe=647C1788&_nc_sid=f4eaf9
