Date,final,likes,comments,url
2023-02-23 14:46:51,"Strategi Menaklukkan Meta Ads yang Sering Gonta Ganti Sistem Ilmu nge-optimasi ads dari Boleh Dicoba Digital Onvbo Marketing Series ae Nge- -ads mr yang Minim Boncos Introduce Meta Ads to Your Business: Pengertian Meta, Konten-konten yang Efektif Bikin Sales Tinggi, plus Tips & Trick Ningkatin Penjualan via Meta Utilize Meta Ads: Bahas Detail Soal Marketing BE [oid (er) Collaborative Ads (CPAS) Problem-problem saat Memanfaatkan Meta Ads bagi Penjualan Produk late 1gee) Case study (Good & Fail Examples) MINGGU, 26 FEBRUARI 2023 PUKUL 13.00 - 15.00 WIB Meta yang sering gonta ganti paear sistem Pah belajar Meta Ads ya, -biar kita cepet kaya —_— Meskipun ga sesering kamu yang suka gonta ganti platform pinjol, Meta udah beberapa kali ngeganti sistem adsnya. Tahun 2022 Meta ngeluarin yang namanya ODAX (Outcome-Driven Ad Experiences). Meskipun keliatan canggih kayak nama anaknya Elon Musk, tapi sebenarnya ini simpel kok. Ini ga ribet kok, justru ngemudahin brand owner ataupun advertiser di postingan ini ODAX ini menyederhanakan objective ads yang awalnya ada 11 cuma jadi 6 aja. Soalnya di sistem yang sebelumnya, banyak yang ngerasa ada tumpeng tumpang tindih. Contohnya yang awalnya 3 poin objective marketing, sekarang cuma butuh sekali klik aja. Oke, biar ga bingung Minbi jelasin di next slide — Meta Ads Campaign With ODAX Coba liat sebelah kiri, terus coba liat tulisan brand awareness, reach, & video views. Nah 3 objective ini sekarang disederhanain jadi awareness doang. Atau objective conversion, catalog series, & store traffic sekarang cuma jadi objective ke sales doang. Dan seterusnya, monggo diinap-inapkan gambarnya. Moga ga pusying:) *Source Image: PPT Mas Jenzo untuk Gossip Forum minggu ini Anyway, nge-ads di Meta ini ada strukturnya, tapi ga ribet kayak organisasi kampus kok 1) Struktur Campaign Campaign e@ Objective Campaign Ini Minbi ngasih penjelasan dikit ya buat yang belum atau baru ngenal ads. Urutannya kayak gambar diatas: Campaign— Ad Set— Ad. Fungsi tiap step ini beda-beda. Tenang ges, ini simpel kok, ciyus. Cukup tanggal tua aja yang bikin pusing, belajar Meta Ads jangan:( Cara ngasih nama campaign Campaign Naming Best Practice Campaign: Objective_Optimization_CampaignName_Period Ad Set: Audinterest_Piacement Ad: ContentName_Piacement_Period Kak Jenzo VP Digital Marketing Operation dari BDD ngasih best practice gimana cara ngasih nama campaign yang bagus. Konsepnya rada mirip kayak kita ngasih nama di file explorer. Kudu ditulis rapin & terstruktur. Makin rapih makin enak buat nyari-nyari kalo dibutuhin Jangan lupa pasangin UTM ke Ads, biar enak ditrack Ma minta duit buat beli kelas DNVB , ry | ‘ : es x oa a Akhirnya tobat j juga ni- 4 bocah cuma nyari © ae meme doang— Gampangnya UTM ini semacam link yang kita masukin ke pengaturan ads. Ini ngebantu kita buat tahu channel campaign, atau platform apa yan aling banyak ngasilin value ke ads kita. Value ga cuma sales ya ges, bisa awareness, engagement, dan lainnya. Seperti kisah cintamu, Kekecewaan di ads berawal dari ekspektasi yang salah T Funnel Objectives Est Results"" Period Amount Spend Landing Page | Brand 20.000 Ad | Awareness Renae | a Feb Ist 28th 2021 IDR 1.009.000 instegram tenieaePa | Website; Traffic Views (EP). | 20c0Lpy | Febtst~ 28th 2021 10R 3.000.000 Product Detail Collection Page Ini tabel yang dikasih sama Mas Jenzo buat contoh acuan gimana cara nge-plan budget, estimasi KPI, sampai landing page buat campaign. Jadi engga cuma ngeads terus nunggu hasil bagus apa kaga, tapi kasih targetan sejak awal. Biar tahu kita ini lagi di fase gagal atau adsnya udah tergolong erarg berHman berhasil. [buat yg masih bingung soal per-ads-an duniawii]",926,29.0,https://scontent-iad3-1.cdninstagram.com/v/t51.2885-15/332571093_723697989137116_4383485968537476566_n.jpg?stp=dst-jpg_e35_p1080x1080&_nc_ht=scontent-iad3-1.cdninstagram.com&_nc_cat=104&_nc_ohc=-WcyrWDhpFYAX8l5n4C&edm=APU89FABAAAA&ccb=7-5&oh=00_AfDz1t7uF8_iZyJqUIWkY8T4vm_9wP4nArJtcMqwIMbyRA&oe=647C68E2&_nc_sid=f4eaf9
2023-02-23 12:12:58,Begini cara ngukur performa konten dan jangan lupain hal ini yaa.. dnvb Marketing Series None None None None None None None None [yuk dicatet yukk..],635,5.0,https://scontent-iad3-1.cdninstagram.com/v/t51.2885-15/332239315_220458573764425_7505564293860837933_n.jpg?stp=dst-jpg_e15_fr_p1080x1080&_nc_ht=scontent-iad3-1.cdninstagram.com&_nc_cat=101&_nc_ohc=TTW8tp19CzwAX9lpai6&edm=APU89FABAAAA&ccb=7-5&oh=00_AfCok6NMluYMP5GXOcZ2zilDKSPtEa8jLe-IQ-xdziYKhQ&oe=6478E5A4&_nc_sid=f4eaf9
2023-02-22 12:58:25,"Nge-set budget, nentuin objective, testing ads, & segala naninu yang perlu kita tahu buat ngiklan di Meta Ads Onvb Marketing Series ae Nge- -ads mr yang Minim Boncos Introduce Meta Ads to Your Business: Pengertian Meta, Konten-konten yang Efektif Bikin Sales Tinggi, plus Tips & Trick Ningkatin Penjualan via Meta Utilize Meta Ads: Bahas Detail Soal Marketing BE [oid (er) Collaborative Ads (CPAS) Problem-problem saat Memanfaatkan Meta Ads bagi Penjualan Produk late 1gee) Case study (Good & Fail Examples) MINGGU, 26 FEBRUARI 2023 PUKUL 13.00 - 15.00 WIB Kata orang, iklan itu anno(an)ying Bisnis kita gagal, ssoalnya boncos terus. “Maap ya mas Aku g papa, semua \\ \modainya dari tabungan kamu kok. Survey dari Kantar Firm, 8 per 10 orang bilang kalo ads di medsos itu ganggu abiez. Tapi the problem is, brand butuh ads buat naikin penjualannya. Lalu baiknya gimana? Tenang, coba kita baca pelan postingan ini sampai selesai — Mending nge-boost post aja atau kudu nge-ads? . Aw =] EN) ADS rF MANAGER Mas Jenzo VP Digital Marketing Operation Boleh Dicoba Digital bilang, kelebihan dari boost post adalah: e Gampang di set up e Bisa naikin engagement e Unique CTA kayak: visit profile, visit website, dan pesan langsung. Boost post berguna buat konten kaya give away, free event, dll. Tapi kalo buat sales.. emm.. Ads manager lebih advance & lebih cuan? 2. Ads Manager Get more options for Business — ° Objectives. Cee aes 7 : — © Many options for creative ad display @ Many budgeting & scheduling options Optim: 2 data driven marketing @ Optimizing Lot of metrics to consider Nah, kalo ads manager ini lebin kompleks. Mulai dari pengaturan ad display, budgeting, scheduling, dan tombol nana ninu lainnya. Di sini enaknya kita bisa ngelakuin data driven marketing, soalnya metrics & datanya buanyak bangettt. Bisa jadi lebih banyak dari saldo rekening akhir bulanmu saat ini. Berapa sih angka yang kudu disiapin kalo baru mulai berbisnis? Kita mulai bareng, = daftarin ktp mu “buat a Buat kamu yang masih baru-baru mau nge-ads, Mas Jenzo nyaranin budget marketing di angka 12-20% dari target penjualan. Jadi kalo target omsetmu 100juta, maksimal cuma 20 juta yang boleh kamu pakai buat modal nge-ads. Angka gede ini berguna buat naikin awareness brand & testing formula ads. Tips buat bisnis yang udah lama jalan, tapi baru mau coba nge-ads Budget Allocation SUGGESTED MARKETING PERCENTAGE New ] Companies = | = — Companies Np | telson Companies of Gross Revenue 12-20% sb prem rooms ) % Kalo casenya bisnismu udah established & mau naikin sales pake ads, kamu bisa pake formula 6-12% budget ads. Ini sifatnya saran dari expert yaa, jadi kalo brandmu nemu formula yang lebih rendah budgetnya bakal lebih muantap. Established vay Companies Ciececns hy Set goals sejelas-jelasnya Conversion Ga harus semua objective marketing kita harus langsung ngarah ke sales. Ini ngikutin konsep yang ada di funnel marketing. Misalnya, buat kamu yang baru awal-awal nge-ads mungkin butuh nyari awareness dulu. Atau buat brand yang awalnya full organic lalu pengen ke paid ads, bisa langsung lompat ke sales. Coba testing dulu, jangan sekali hantam Lari menuju profit dan melampuinya Berhubung nge-ads ini pake duit (ga pake daun), jadi kalo belum nemu formula yang maknyus kamu kudu ada fase testing dulu. Ini termasuk ngetest: objective marketing, budget, target audience, dan lain-lain. Kalo dari beberapa experiment ini nemu formula yang bagus, berarti tinggal di gaspoll. [gimana, masih bingung? 😂]",633,8.0,https://scontent-iad3-1.cdninstagram.com/v/t51.2885-15/332248058_750268473031624_2216466513769284790_n.jpg?stp=dst-jpg_e35_p1080x1080&_nc_ht=scontent-iad3-1.cdninstagram.com&_nc_cat=104&_nc_ohc=jTVByyHa5kwAX-Lrpte&edm=APU89FABAAAA&ccb=7-5&oh=00_AfC5jjVP9TrJpOi67CdQgZlzFv_I0sbNHfYeIrwm0wWsYQ&oe=647C34FB&_nc_sid=f4eaf9
2023-02-22 11:07:13,"Jangan cuma “Ready ka’ aja, tapi coba jawab kayak gini ke customer kamu.. dnvb Marketing Series None None None None None None None None [bosen ga siih ""ready ka"" terus?]",7536,78.0,https://scontent-iad3-1.cdninstagram.com/v/t51.2885-15/332330016_1389934068429334_1021833731462706733_n.jpg?stp=dst-jpg_e15_fr_p1080x1080&_nc_ht=scontent-iad3-1.cdninstagram.com&_nc_cat=110&_nc_ohc=bFDPM012mGwAX81_Wqf&edm=APU89FABAAAA&ccb=7-5&oh=00_AfBzjQIe6ADeLlzsJzJmMql1or8oKKwK2E3FbJMvAO9DSA&oe=6479327E&_nc_sid=f4eaf9
2023-02-21 10:57:38,Tips biar deket sama customer dnvb Marketing Series None None None None None None None None [ginii caranya biar connect sama customerr.. 😆],917,22.0,https://scontent-iad3-1.cdninstagram.com/v/t51.2885-15/331851187_736425801467912_8421809911443799385_n.jpg?stp=dst-jpg_e15_fr_p1080x1080&_nc_ht=scontent-iad3-1.cdninstagram.com&_nc_cat=108&_nc_ohc=CCWXtQJ2di0AX_cyk32&edm=APU89FABAAAA&ccb=7-5&oh=00_AfDld34pyQma6oJwYik4b3Ca51EuJY80QHvAkj-GtPGUHg&oe=647923E2&_nc_sid=f4eaf9
2023-02-20 15:20:28,"Belajar Meta Ads bareng BDD, agency di balik ratusan brand gede yang udah ngelola miliaran duit ads Onvb Marketing Series ae Nge- -ads mr yang Minim Boncos Introduce Meta Ads to Your Business: Pengertian Meta, Konten-konten yang Efektif Bikin Sales Tinggi, plus Tips & Trick Ningkatin Penjualan via Meta Utilize Meta Ads: Bahas Detail Soal Marketing BE [oid (er) Collaborative Ads (CPAS) Problem-problem saat Memanfaatkan Meta Ads bagi Penjualan Produk late 1gee) Case study (Good & Fail Examples) MINGGU, 26 FEBRUARI 2023 PUKUL 13.00 - 15.00 WIB Banyak korban dari perkara nge-ads ini ges :( Pernah banget () ini tuh waktu masih nyoba pake format baru campaign baru. Ancyur ancyuran minggu pertama, minggu ke 2 coba lagi, hasilnya tetep ga nutup, minggu ke 3 cuma balik modal minggu ke 4 ancyur h lagi, alhasil ganti campaign @y Kadang suka kesel kalo udh ngeads di fb (sengaja karena target pasar itu bapak bapak dan emak emak) tapi leads dikit. Kecewa aja gitu. Pernah dong selama sehari leads cmn 2. Saketttt wkwk Modal habis, cuan tak balik. Apakah kamu juga? Nge-ads lewat Meta ga cuma nyiapin modal & main klik doang, tapi kudu siapin strategi ujung ke ujung Boncos pake fb ads. Sehari 800k terus CSnya masih newbie wkwk closingan ngga mencapai target dan yasudah. Ngga ketutup dong hehe Masalah nge-ads ini sifanya juga end to end. Ga cukup cuma bikin konten dan nge-set target audience. Bisa aja ads kita berhasil bikin audience tertarik, tapi gagal closing. Misal pas customer nanya-nanya, CS-nya malah galak banget kaya temenmu pas kamu tagih utang. Nge-ads yang makin hari makin syulid kurang suka A 7 pelajaran sekolah? i Data dari Adespresso, biaya nge-ads makin tinggi dari 2020 ke 2021. Biaya Cost Per Click (CPC) naik sebanyak 17%. Jadi kalo untuk bikin audience ngeklik iklan kita biasanya butuh Rp.1.000, sekarang butuh Rp.1.170. Kalo dalam sebulan yang ngelklik adalah 10.000 orang. Maka yang harusnya ngeluarin duit Rp.10.000.000, jadi kudu ngeluarin Rp11.700.000. To the point ke audience Ada ya orang alergi sama diri sendiri? Nge-ads pake Meta bisa nyampein message kita ke audience yang tepat. Mulai dari demografis, umur, sampai interest kayak yang suka makan jengkol, seneng olahraga, sampai yang suka sama artis kayak Reza Rahadian. Jadi pastiin dulu sebelum nge-ads, target audience udah clear. Marketing pertama adalah produk! ads gue jangan lupa beli ya Ini yang kudu dinotice banget buat yang mau nge-ads. Marketing yang paling utama adalah produknya. Kalo produknya jelek, mau dimarketingin kaya gimana juga susah. Atau kejual sekali, abis itu pada kapok beli lagi. Apakah produk yang jelek tetap bisa dijual? = ee Z ) Duit udah abis buat nge-ads, Produk jelek sebenernya bisa aja dijual dan laku kalo di-ads, asalkan marketingnya bisa “dikemas” dengan baik. Tapi ya itu tadi, bikin marketing yang bombastis bisa bikin retentionnya rendah. Alias ga akan ada loyal customer yang muncul. So, core of the core dari marketing tetep wajib punya produk yang cakep. Minggu ini kita akan belajar sama VP Digital Marketing Operation dari sebuah Agency yang udah punya 600an klien & pernah ngelola 180 miliar rupiah dana ads: BDD! bodypack Tirajeans® logitech B MAHIK \ AA231 Par Weer Klien yang dipegangnya ga kaleng-kaleng, beragam industri dan banyak brand gede juga! [yg ga mau boncos mana suaranyaaa 😁🤚]",1785,45.0,https://scontent-iad3-1.cdninstagram.com/v/t51.2885-15/331714825_1154497768599403_1122696471866150057_n.jpg?stp=dst-jpg_e35_p1080x1080&_nc_ht=scontent-iad3-1.cdninstagram.com&_nc_cat=107&_nc_ohc=MvGWHkhjUpkAX85NSng&edm=APU89FABAAAA&ccb=7-5&oh=00_AfCNCUMGW7LgzXRsJQ3WTrYURxovkm9OzgnSwAFe3KteZA&oe=647B5946&_nc_sid=f4eaf9
2023-02-20 09:33:22,Unsur utama konten viral: KONT... dnvb Marketing Series None None None None None None None None [mengandung apa yaa..?? 🤔🤔],385,30.0,https://scontent-iad3-1.cdninstagram.com/v/t51.2885-15/331997518_582424766858302_1236965659574079516_n.jpg?stp=dst-jpg_e15&_nc_ht=scontent-iad3-1.cdninstagram.com&_nc_cat=110&_nc_ohc=6V1OedC_bG0AX-Yx6s_&edm=APU89FABAAAA&ccb=7-5&oh=00_AfAlg9cgEslIUl1YifSl1AGBnRy-gjapk0LKnSBDMhhWkg&oe=6478ADA2&_nc_sid=f4eaf9
2023-02-17 13:20:38,"Wer: |. (Um ol-lairele endorse abis 30 juta, tapi omset ga sampe 5 juta’ — curhatan sobat Minbi Ini dia cara biar KOL marketingmu ga bikin nangis lagi dOnvbo Marketing Series KOL Marketing Biar Jualan Lebih Cuan: Strategi, Eksekusi, sampe Evaluasi Cara Nyusun Target & Strategi KOL Marketing yang Efektif Cara Eksekusi KOL Marketing Seberapa ngaruh KOL Marketing ke Brand?: dari Awareness, Desire, sampai Sales Rumus Kombinasi KOL + Ads Marketing Monitor Efektifitas KOL Marketing: dari Perencanaan sampai Implementasi Review: Variabel Signifikan & yang Ga Signifikan buat Strategi KOL Marketing Case study (Good & Fail) MINGGU, 19 FEBRUARI 2023 PUKUL 13.00 - 15.00 WIB Santi Tan Co-founder Saff & Co Harga ma) LINK ON BIO Seminggu ini Minbi dapet keluhan dari warga +62 Aku udh daftar. Alasan ikut pengen balas dendam. Endorse abis 30jt tp w omset gak sampe 5jt @P () Min endorse itukan nyari traffic tapi ga bisa di control. Ko pada Berni spend @) diangka sgtu ?? Biaya terbatas apa bisa optimal min? Kendala brand lokal biasa nya dana ‘? Extra nya ngak terlalu besar :( Bgt min, buat umkm ky kami keluarin banyak buat influencer hasil nga bgtu bagus, pke nano kurang impact, pdhl udah reguler dilakuin tiap bulan... akhirnya demotivation krn nombok & terus So, konten ini bakal bahas step by step biar Kejadian yang buruk ga terulang lagi = [1] Make sure dulu product & target audience udah aman Lu mau endorse gue lagi ga? a=. J = — ~ /, Lo dibrief buat senatural mgkn/ malah bilang “ini mahal, gue aja _-cuma diendorse”. Natural® _ Influencer tuh biasanya sering nerima tawaran endorse dari brand lain. Jadi make sure kita bisa bikin influencer yakin sama produk kita (yang saingannya sebanyak kenangan masa lalu). Abis itu make sure mereka promosiin dengan sepenuh hati. Yang paling penting, kamu udah riset & yakin kalo target audiensmu sesuai sama audiens si influencer. [2] Tentuin objective yang jelas buat semua aktivitas KOL marketing Dampak KOL Marketing pada Brand: dari Awareness, Desire, sampai Sales © KONTROL EKSPEKTAS! saat melakukan KOL Marketing, fokus utama bukan SALES, melainkan AWARENESS Metric: conversion rate, KOL affiliate sales Metric: new followers, profile visit, MP add to cart Metric: reach, impression, views dnvob Masing-masing brand bisa punya objective yang beda tiap nge-endorse influencer. Ada yang nembak langsung ke sales. Ada juga yang targetnya lebih ke desire dan buat salesnya dibantu sama ads marketing yang lain. Cara KOL + ads ini yang dipake sama SAFF & Co dan terbukti bisa jualan puluhan ribu produk dalam sebulan! [3] Prinsipnya kayak milih pasangan hidup: KOL harus cocok sama “brand” kita el — Kalo aku jadi Raffi’ Ahmad, kamu mau ga ~ |)Raffi Anmad duitnya ! Wi panel, Kamu? Dee) Biar ga bingung & ngasal, milih influencer kudu diprofiling dulu. Kira-kira mana yang valuenya cocok sama brand kita? Persona si influencer sama ga dengan style brand kita? Plus, karena KOL ini manusia, jadi kita Kudu siap-siap kalo ada yang moodyan, picky, sampai yang galak :) Oiya, follower banyak belum tentu lebih bagus yaa. Jadi engangement ratenya kudu dipertimbangin juga. [4] Siapin brief yang bikin KOL sekali baca langsung ngerti. Creating a brief that delivers oe, T/~ ate ree eee fun and exciting summer tt vacation with mmer vacation in a bottle a Compared to reviews seperti “Oh ya wanginya enak” “Enak wanginya aku suka” “Iya wanginya manis, enak” “Enak yg ini” Brief yang keren itu kaya misal: 1. Ada highlight USP (unique selling oo le position) dari produk kita. Gimmick dikit ga papa, asal ga bohong Brief yang bisa ngedorong KOL buat nyentuh isi hati customer Plus, SAFF & Co suka nyelipin review dari tim sendiri ke dalam brief [5] Sekali post atau beberapa kali? K' 4 | Ke &\ \ ill ~ \ 4 \ \ . / Gmnmauover \ \\ / thinking, “think” saja \ \ : | kamu tidak \ \ | as Kata Santi Tan Co-Foundernya SAFF & Co, untuk case ngelaunch produk, batch post is recommended. Beberapa kali postingan sangat dianjurkan. Soalnya kalo roduk baru itu butuh effort lebih buat bikin orang kenal, apalagi jadiin ke sales. Ini kayak fase hidup, ga mungkin kan sekali kenal orang langsung kamu tembak? Kudu ada ancang-ancang PDKT dulu sebelumnya. [6] Udah deal? Sabar dulu, kasih waktu si influencer buat nyobain produk kita (trial period) miliar. Alhamdulillah udah ¥ kekumpul 10 ribu “@ iss, "" , ES Goals kita pake KOL ini buat marketing yang lebih “menyentuh” bukan? Nah biar bener-bener nyentuh emosi customer, KOL sebaiknya dikasih waktu buat cobain dan pastiin mereka “cinta” sama produknya, sebelum nyaranin orang lain buat beli. Biar seperti kata pepatah, “Yang dari hati akan sampai ke hati”. [akhiri curhatanmu, mari belajar bersamaku]",3254,52.0,https://scontent-iad3-1.cdninstagram.com/v/t51.2885-15/331076978_914422716649897_1775397062094520080_n.jpg?stp=dst-jpg_e35_p1080x1080&_nc_ht=scontent-iad3-1.cdninstagram.com&_nc_cat=101&_nc_ohc=kIVwis4aQPkAX-g406H&edm=APU89FABAAAA&ccb=7-5&oh=00_AfBHFWWuOv7V9QclReHrdJg-3TSTD01zGC1chozxQPGrlg&oe=647C4016&_nc_sid=f4eaf9
2023-02-16 13:40:51,"Cara SAFF & Co dapetin return 30x lipat lewat KOL marketing efektivitas KOL marketing dnvo NE ene eyeS? KOL Marketing Biar Jualan Lebih Cuan: Strategi, Eksekusi, saampe Evaluasi Cara Nyusun Target & Strategi KOL Marketing yang Efektif Cara Eksekusi KOL Marketing Seberapa ngaruh KOL Marketing ke Brand?: dari Awareness, Desire, sampai Sales Rumus Kombinasi KOL + Ads Marketing Monitor Efektifitas KOL Marketing: dari Perencanaan sampai Implementasi Review: Variabel Signifikan & yang Ga Signifikan buat Strategi KOL Marketing Case study (Good & Fail) MINGGU, 19 FEBRUARI 2023 PUKUL 13.00 - 15.00 WIB Fa Ta) Co-founder Saff & Co Harga (ma) LINK ON BIO KOL marketing ga sebatas nyari influencer lalu posting Ngejalanin KOL marketing ga segampang nyari influencer, bayar, lalu posting. Ada tahapan dan analisa yang kudu disiapin. Mulai dari analisa produk, market, nentuin objective campaign, bikin brief, sampai ngukur efektivitas marketing. Cara Mengeksekusi KOL Marketing Analyze PRODUCT dnvo Brief yang cakep adalah yang bisa ngasih highlight produk Campaign yang bagus bermula dari influencer yang ngerti apa isi produk. Cara bikin influencer bisa paham goals dari brand kita adalah, dengan bikin brief yang bisa bikin mereka paham dan bilang, “Oh oke, produknya begini, keknya bisa gue endorse-in dengan cara gini deh”. PRODUCT KNOWLEDGE 0.7.6 is short for Sex on the Beach, a sweet ref cocktail bes on your favourite beach. Definitely A $.0.1.B captures the perfect summer dream like no other sun- kissed skin, sexy bikinis, fun pool parties, and a glass of refreshing Sex on the Beach! Designed with an exciting blend of mandarin, sweet floral notes, and - ~~ rich vanilla musk, this tropical scent will remind you of the warm sea breeze, soft sands, and lush palm trees on a hot summer day. *Gambar diambil dari PPTnya Kak Santi Tan untuk Gossip Forum minggu ini dengan tema “KOL Marketing” Bikin brief yang bisa nyentuh sisi emosional audiens Ayo cepet gelut gue eon OLE be Pastikan brief yang dikasih ke KOL bisa nge-encourage mereka buat nyentuh sisi emosi audience. Bisa ga kira-kira brief kita dipahami sama KOL, lalu mereka bisa nge-create story yang bikin audience ngerasa cakep, tajir, atau jadi si paling-paling dengan pake produk kita? Biar maksimal, pastiin KOL-nya cinta dulu sama produk kita Bro mau ikutan ‘OC Gue udah peliharay babi 3, nyetok lilin 3% dus Hal yang ga kalah penting, usahain bikin KOL suka sama produk kita. Biar mereka bisa ngeshare kisah mereka dengan lebih genuine dan ga dibuat-buat. Soalnya anak muda zaman sekarang punya skill untuk tahu mana yang iklan dan berkata, “dih perez”. KOL + ads marketing = pendapatan 30x lipat Setelah menggabungkan metode KOL dan ads marketing, SAFF & Co bisa ningkatin ROAS (return) yang angka awalnya di bawah 10 ke angka 30an. Jadi kalo invest buat marketing misalnya 10 juta, kita dapetin sales sebanyak 300 juta. ROAS Ads with KOL Marketing higher, better Soy ts) 39,29, 32 dnvo KOL — Desire, Ads — sales Kombinasi KOL dan Ads Marketing Kadang KOL Marketing sudah berhasil menimbulkan DESIRE Tapi orang menunda/lupa/belum benar2 mau langsung membeli, DESIRE SALES tertunda Gimana cara push lagi agar terjadi SALES/CONVERSION? e@ Support KOL Marketing dengan digital Ads: FB Ads, MP Ads, Tiktok Video Shopping (Yellowcart Ads) AWARENESS dnvbob Kata Kak Santi Tan, di marketing funnel, KOL itu rata-rata cuma ngegiring customer sampai tahap desire. Nah biar dia naik ke tahap sales, butuh dibantu sama sama ads marketing. SAFF & Co memakai 90% budget marketingnya untuk KOL, sedangkan 10%nya untuk ads marketing. Setelah ngeluarin duit, jangan lupa ngukur efektivitasnya PN aT ters STICKER COST PER Petia FOLLOWERS | IGs/IG feed REACH as REACH Rss es 7s emia seeds PAT Tero dnvo KOL yang mahal belum tentu ngasilin hasil yang baik. Bahkan influencer dengan follower yang lebih banyak belum tentu ngasilin sales & engangement lebih gede. Makanya perlu buat penilaian di akhir. Nah, matriks buat ngukurnya ga cuma sales doang, tapi ada banyak. Mulai dari link klik, cost per reach, follower number, dan lain-lain [penasaran gaa, gimana brief ke influencer?]",1301,22.0,https://scontent-iad3-1.cdninstagram.com/v/t51.2885-15/330695636_3332047380388426_4390857651107068988_n.jpg?stp=dst-jpg_e35_p1080x1080&_nc_ht=scontent-iad3-1.cdninstagram.com&_nc_cat=110&_nc_ohc=EWTpbUoDzwwAX8YWLCY&edm=APU89FABAAAA&ccb=7-5&oh=00_AfBZnW-SDoAtSygzn-hyPdjTUpUBIHXO5wHEoApYBiE_6Q&oe=647BD2F2&_nc_sid=f4eaf9
2023-02-16 10:32:35,Ini rahasia konten viral dari Creative Director GOJEK.. © gojek dnvb Marketing Series None None None None None None None None [belajar sama Creative Director nya GOJEK sinii],617,22.0,https://scontent-iad3-2.cdninstagram.com/v/t51.2885-15/330869428_3012647909029493_8086355087558457879_n.jpg?stp=dst-jpg_e15&_nc_ht=scontent-iad3-2.cdninstagram.com&_nc_cat=105&_nc_ohc=jlYjcxifzWsAX-RXCPD&edm=APU89FABAAAA&ccb=7-5&oh=00_AfClh824v1-jxx1gus2l3m2rw9nyP93nW4qkSJITfZjcGQ&oe=647945B5&_nc_sid=f4eaf9
