Date,final,likes,comments,url
2023-03-15 12:54:17,"Udah bertahun-tahun, tapi iklan AXIS masih jadi top of mind. Ini alesannya.. dOnvb Marketing Series Humor Marketing: Rumus Konten Viral ala Go-Jek Cara Riset Jokes Cara Bikin Jokes yang Viral & Datengin Sales Cara Manage Respon Netizen Faktor-Faktor yang Ngaruh ke Humor Marketing Cara Bikin Jokes yang Ga Cringe Cara Ngukur Efektivitas & Evaluasi Humor Marketing Case study (Good & Fail Examples) Setiap pembelian kelas otomatis dapet video rekaman & bisa diakses seumur hidup! MINGGU, 19 MARET 2023 PUKUL 13.00 - 15.00 WIB = ey, : 4 Iklan legenda Indonesia yang keknya wajib kita bahas... ( a wiwitans Jangan lupakan iklan Axis PB ulfaah99 Jgn lupa iklan axis jaman dulu juga Di konten yang bahas Go-Jek kemaren, ada beberapa yang mention iklan AXIS. Selain viral di masanya, iklan ini juga kocak. Sekocak kamu yang dulu sampai sekarang cuma baca konten DNVB tapi belom pernah beli kelas :( Mari kita tonton together— ess Carga Btn BS * Indonesia ga pernah kehabisan iklan yang lucu dan kreatif. Selain Go-Jek, Axis juga berhasil bikin iklan yang memorable. Advertising Creativity in Advertising: When It Works and When It Doesn’t by Werner J. Reinartz and Peter Saffert Summary. Reprint: R1I3O6H Do highly creative ads really inspire people to buy products? Studies have found that creative messages get more attention and lead to positive attitudes about the products, but there's little evidence linking those messages to purchase... more Artikel di Harvard Business Review bilang, iklan yang kreatif (kocak) bisa lebih memorable, ga cepat redup di pasar, low budget, dan ngebangun fan community. Kenapa iklan lucu kayak punya AXIS banyak fans-nya? Beberapa tahun lalu lembaga Nielsen Global pernah ngadain survey ke 29 ribu orang di 58 negara. Negara beneran, bukan monopoli. Hasil survey menyatakan: 47% responden bilang kalo mereka paling seneng sama iklan yang ada humornya. Ngelawak bisa jadi sumber rejeki Semua manusia normal suka sama komedi. Bahkan banyak suka sama sebuah brand karena bawaannya kocak. Ini didukung sama riset dari Prof Martin Eised yang bilang, marketing yang pake humor bisa ningkatin “purchase intent”, alias kenaikan belanja dari orang-orang. --% Elon Musk @ a @elonmusk Who controls the memes, controls the Universe 2:35 PM - Jun 26, 2020 107.5K Retweets 11.8K Quote Tweets 686.2K Likes Orang terkaya di dunia aja bilang, “Siapa yang jago nge-meme, bisa menguasai semesta”. Edan ga tuh, jangankan keinginan customer, semesta aja bisa dikuasai kalo kita bisa meracik humor di hidup ini sodara. Makanya Minbi suka pake HUMOR MARKETING di tiap ngonten. Ya harapannya tentu saja emoga bisa cepet kaya :) Apa jadinya DNVB tanpa HUMOR MARKETING? dalam lautan meme Artikel di Fast Company bilang, humor udah dipake sama banyak brand di berbagai industri dan terbukti bisa naikin engagement & ningkatin sales. Contohnya simplenya nih, banyak yang akhirnya beli kelas DNVB karena baca meme yang kadang garing dan mancing emosi. [viral pada zamannya 😂]",6991,120.0,https://scontent-iad3-1.cdninstagram.com/v/t51.2885-15/335594028_878905019854906_8956365166446329205_n.jpg?stp=dst-jpg_e35_p1080x1080&_nc_ht=scontent-iad3-1.cdninstagram.com&_nc_cat=110&_nc_ohc=0qBAAnpBwh0AX-ZTjgo&edm=APU89FABAAAA&ccb=7-5&oh=00_AfATCsmXyLK8D5zGdutZ7ZQnsjLN1sHsG0vxE-kkQEUKLA&oe=647D0C30&_nc_sid=f4eaf9
2023-03-15 11:48:35,"Bal etsmeyt-ls roe, ef live ti kamu dnvb Marketing Series None None None None None None None None [ada yang baru mulai ngelive tiktok ga niihh??]",238,3.0,https://scontent-iad3-1.cdninstagram.com/v/t51.2885-15/335695302_1369526640509842_6516801035867147756_n.jpg?stp=dst-jpg_e15_fr_p1080x1080&_nc_ht=scontent-iad3-1.cdninstagram.com&_nc_cat=110&_nc_ohc=JKDIGWPYTicAX8syMoq&edm=APU89FABAAAA&ccb=7-5&oh=00_AfDXBbDlVORvwmfMOzjawnO2Dm-oY-fhiI0dzCU2BzS3rg&oe=64790101&_nc_sid=f4eaf9
2023-03-14 14:09:23,"GoJek, ‘rajanya’ iklan viral yang penuh humor dnvbo Marketing Series Humor Marketing: Rumus Konten Viral ala Go-Jek Cara Riset Jokes Cara Bikin Jokes yang Viral & Datengin Sales Cara Manage Respon Netizen Faktor-Faktor yang Ngaruh ke Humor Marketing Cara Bikin Jokes yang Ga Cringe Cara Ngukur Efektivitas & Evaluasi Humor Marketing Case study (Good & Fail Examples) Setiap pembelian kelas otomatis dapet video rekaman & bisa diakses seumur hidup! MINGGU, 19 MARET 2023 PUKUL 13.00 - 15.00 WIB = ey, : 4 Go-Jek Feat BTS! HUMOR, the power of iklan Go-Jek Pencapaian Go-jek saat ini Sebagai orang yang hobinya nonton ulang iklan-iklan Go-Jek (dan install appsnya), Minbi nemu kesamaan dari kebanyakan iklan Go-Jek: HUMOR. Meskipun kadang garing dan ngundang emosi (kayak konten DNVB), tapi iklan Go-Jek ini ujung-ujungnya selalu keren.  #Go-Sendinstant1Jam, campaign ngeselin & full humor Image source: The Jakarta Post Iklan Go-Send Instant 1 Jam berhasil tembus 1 juta views 24 jam pertama launch. Menurut The Jakarta Post, iklan ini bisa ngena ke top of mind netizen karena ngeremake lagu yang bangkitin nostalgia, “Ada Apa Denganmu’. Humor = bagian marketing Data dari Forbes bilang, 90% orang lebih ingat sama brand yang bawaannya fun. Sementara 48% ngerasa ga punya “rasa” sama brand yang ga nyentuh sisi humor mereka. Ini kali ya yang bikin banyak orang-orang masih ingat sama iklan Go-Jek: humor. Banyak orang ga tau cara bikin humor di marketingnya. Takut cringe, kali ya? Kok lu jadi gundul juga kaya gue bro Survey lembaga Oracle, 95% business leader ngerasa takut buat pake humor untuk berinteraksi sama customernya. Nah problemnya nih, pas udah sadar kalo pake humor itu penting, 85% ngaku kalo mereka ga tahu cara bikin humor di marketingnya. Masih inget sama ini? Kelas Gossip Forum terbanyak dalam sejarah perjalanan umat manusia! 1000 pcs sold out sampe terpaksa tutup warung sebelum waktunya. JOVEMBER 2022 MINGGU, 6 WY 13.00 - 15.00 wiB Nah, karena rame & banyak yang “nagih” sama Mas Bahari, gimana kalo kita gasss lagi belajar sama beliau? [jualan pake humorr 🤪]",6967,80.0,https://scontent-iad3-1.cdninstagram.com/v/t51.2885-15/335971767_908121073731739_5951026386248461827_n.jpg?stp=dst-jpg_e35_p1080x1080&_nc_ht=scontent-iad3-1.cdninstagram.com&_nc_cat=107&_nc_ohc=BlkJGWROgAoAX9pnKEy&edm=APU89FABAAAA&ccb=7-5&oh=00_AfC7CVgL3VI4b51vhNOB9FxXykXh54GC3LYOYr_NYXuheQ&oe=647CF46A&_nc_sid=f4eaf9
2023-03-10 12:27:11,"Copywriting yang berhasil nailkin sales sampe 50% Cerita iklan legenda Rolls-Royce dOnvb Marketing Series Copywriting: How to Write Advertisement that Sells Anatomi Copywriting yang Berhasil Eksekusi: Cara Riset & A/B Test Copywriting Cara Nulis Iklan yang Efektif & Memikat Manajemen Mood dan Kreativitas Manajemen Respon Netizen (Expecting the Expected) Monitor Efektivitas Copywriting Harga Case study (Good & Fail Pr Iza Examples) : MINGGU, 12 MARET 2023 mac) PUKUL 13.00 - 15.00 WIB aod Ini adalah iklan hasil karya The Father of Advertising asal Inggris, David Ogilvy The Rollefoyce Silver Cloud—$13,995 “At 60 miles an hour the loudest noise in this new Rolls-Royce comes from the electric clock” What makes Rolls-Royce the best car in the world? “There is really no magic about it— it is merely patient attention to detail,” says an eminent Rolls-Royce engineer. 1. “At 60 miles an hour the loudest noise ‘comes from the electric clock,” reports the Technical Editor of v1 moron. ‘Three muf- flers tune out sound Frequencies—acoustically. 2, Every Rolls-Royce engine is run for seven hours at full throtele before installation, and each car is testdriven for hundreds of miles over varying road surfaces. 3, The Rolls-Royce is designed as an owner- driven cat. Its eighteen inches shorter than the largest domestic cars. 4, The car has power steering, power brakes and automatic gearshift. It is very easy 10 drive and to park. No chauffeur required. 5. The finished car spends a week in the final testshop, being finetuned. Here it is sub- jected t0 98 separate ordeals. For example, the engineers use a stethoscope to listen for axle- whine. 6. The Rolls-Ro is guaranteed for three years. With a new network of dealers and partsdepots from Coast 10 Coast, service is xo problem. 7. The Rolli-Royce radiator has never changed, except that when Sir Henry Royce died in 1933 the monogram RR was changed from red to black, 8. The coachwork is given five coats of primer paint, and hand rubbed between each coat, before nine coats of finishing paint go on. 9. By mo ‘umn, you can adjust the shock absorbers to suit road conditions. 10. A picnic table, veneered in French wal- rut, slides out from under the dash. ‘Two ‘more swing out behind the front seats. 4 switeh om the steering col- 11. You can get such optional extras as an Espresso coffee making machine, a dictating machine, a bed, hot and cold water for wash- ing, an electric razor or a telephone, 12, There are three brakes, two hydraulic and one mechanical Damage 0 one system will not affect the others. The Rolls-Royce isa very safe car—and also a very lively car. It cruises serenel eight 13. The Bentley is made by Rolls Roy cept for the radiators, they are identical mo- tor cats, manufactured by the same engineers in the same works. People who feel diffident about driving a Rolls Royce can bu y price. The Rolls-Royce illustrated in this ad: vyertisement—F.o.b. principal ports of entry— costs $13,995. rate systems of power If you would like the rewarding experience of driving a Rolls Royce or Bentley, write or telephone to one of the dealers listed on the opposite page. Rolls Royce Inc., 10 Rockefeller Plaza, New York 20, N. ¥,, Clrcle 5-114 March 1959) el Iklan yang terbit di tahun 1958 ini jadi legend pada masanya karena... Copywritingnya. Karena bahasa yang dipake sangat cerdas. The Rolls-Royce Silver Cloud —$13,995 “At 60 miles an hour the loudest noise in this new Rolls-Royce comes from the electric clock” Po a a ne ee thes aun? hove ie vonlly na macic abour it— “Dalam kecepatan 60 mil perjam, suara paling bising di mobil Rolls-Royce ini cuma berasal dari bunyi dentingan jam”, gitu kurang lebih bunyinya. Iklan ini ga pake kalimat, “mobil ini bunyinya sangat halus”. Tapi pake kalimat yang memantik emosional audience. Kalo ditulis ga lebih bising dari bunyi jam, pasti pikiran kita bakal ngebayangin bunyi jam terus bilang, “wow, kalo gitu bunyi mobilnya halus bangett dong’. Iklan yang viral mampus pada masanya ini cuma diiklanin lewat dua majalah, tapi hasilnya luar binasa Ini surat resign saya pakp bangk t— angkru \ es AEGON, Iklan ini berhasil nakin sales Rolls-Royce sampai 50% di tahun 1957 ke 1958. Menurut Tim Huru Hara Fakta (THHF) DNVB, berkat iklan tadi Rolls-Royce sampai punya 18 bulan waiting-list untuk produksi mobinyal. Yaa semacam pre-order kali ya bahasanya sekarang. Riset, riset , dan riset! | 7 J buat self reward wiki | Buat bikin copywritingnya, Om David ngabisin waktu 3 minggu penuh buat mempelajari tentang “dunia mobil’. Jadi proses kreatif seorang copywriter ga Cuma bengong terus tiba-tiba ilham dateng (bukan juga agus, roni, dkk yang dateng), tapi ada proses riset panjang di baliknya. “People buy on emotions, and justify their purchasing decision with fact” — a 1 i r Menyelam bentar ya nak, 2 } jam lagipapaangkat ) | es Orang-orang beli karena faktor emosional, lalu membenarkan keputusan pembeliannya dengan fakta. Buat bikin copywriting yang bisa nyentuh emosi, kita bener-bener kudu paham fakta dari produknya, baru dipoles biar lebih ‘emosional’. Kayak konten DNVB, selalu nyampein fakta yang dibalut dengan garing serta pembawaan penuh emosi (emosi negatif wakakaka). Kalo copywriting iklan kita berhasil nyentuh hati audience, kelar sudah :) = Scroll2 laptop biar ga dikira | nganggur pas di cafe : Forbes bilang, emotional engagement bisa bikin orang notice dan inget terus sama sebuah campaign. Kalo bahasa kerennya, “People will forget what you said, people will forget what you did, but people will never forget how you made them feel”. Minbi dikasih lihat sama Kak TB gimana proses kreatif dia waktu ngerancang campaign #cerdikiawan. waktu itu ceritanya Go-Jek pengen ngenalin kalo produk mereka udah banyak, ga cuma ojek onlen. Iklan yang udah ditonton ratusan juta kali di YouTube itu meskipun cuma semenit, tapi terngiang di kepala bertahun-tahun. Persis cicilan KPRmu yang lamanya masih hitungan tahun. [pentingnya nulis yang menyentuh hati..]",1441,13.0,https://scontent-iad3-1.cdninstagram.com/v/t51.2885-15/334647752_747800583451441_3743803599523395541_n.jpg?stp=dst-jpg_e35_p1080x1080&_nc_ht=scontent-iad3-1.cdninstagram.com&_nc_cat=101&_nc_ohc=rJneTzXfCwsAX8jVEOK&edm=APU89FABAAAA&ccb=7-5&oh=00_AfD9-jwYyUm3pDnzAS7XCShjPNaMJl1utNSORRnAc1pJXw&oe=647CC626&_nc_sid=f4eaf9
2023-03-10 11:43:25,Ga se cust mau dipanggil ini.. Cre) Marketing Series None None None None None None None None [coba cari panggilan sayang buat customermu yaaa 😉],824,5.0,https://scontent-iad3-1.cdninstagram.com/v/t51.2885-15/334283879_194802529847662_2082838082050255827_n.jpg?stp=dst-jpg_e15_fr_p1080x1080&_nc_ht=scontent-iad3-1.cdninstagram.com&_nc_cat=110&_nc_ohc=JT9pZEGxoUIAX82lEqp&edm=APU89FABAAAA&ccb=7-5&oh=00_AfBOW9OV-lnWUTJftKsPYwWpo0bAXoNzC2Q7XNnIgMoquQ&oe=6478A3BF&_nc_sid=f4eaf9
2023-03-09 13:23:02,"Penjualan Subway naik 18% STi Cal ree mengubah data jadi cerita Gimana caranya? dnvbob Marketing Series Copywriting: How to Write Advertisement that Sells Anatomi Copywriting yang Berhasil Eksekusi: Cara Riset & A/B Test Copywriting Cara Nulis Iklan yang Efektif & Memikat Manajemen Mood dan Kreativitas Manajemen Respon Netizen (Expecting the Expected) Monitor Efektivitas Copywriting Case study (Good & Fail oY Examples) tf MINGGU, 12 MARET 2023 PUKUL 13.00 - 15.00 WIB Cara Subway mengemas fakta dengan cerita = we | P oe "" Source: Daily mail Awal tahun 2000an, Subway ngangkat campaign tentang healthy food gara-gara ngeliat Amerika lagi dilanda masalah obesitas. Alih-alin bikin campaign yang nyeritain kandungan gizi, nutrisi, dan segala macem di makanannya, brand asal Amerika ini justru bikin iklan yang ngangkat sebuah kisah. And it’s work. Bukan pamer data statistik, tapi cerita ~~ Enak juga tidur. Enak lagi kalo bangun-bangun udah kaya raya rat sce] Campaign ini nyeritain seorang anak muda yang lagi jalanin program diet. Salah satu program dietnya, dia makan makanan sehat dari Subway. Makanan sehat subway berhasil nurunin berat babang tadi sebanyak 50 kg. Campaign ini dipake sama Subway hampir selama 16 tahun a Tuhan, semoga yg kerjaannya cuma baca meme kali ini beli kelas Cara Subway ngasih tahu promosinya lewat jalan ‘cerita’ ini berhasil naikin sales sampai 18%. Padahal di era itu, rata-rata brand makanan paling cuma punya sales growth antara 7-10%. Alasan kenapa banyak orang hafal nama tokoh-tokoh Marvel ss S ge ( \ _-Paling cabut kelas trs bobol ATM mah Pas di sekolah jangan bandel ya ‘| Forbes bilang, sebuah cerita bisa 22x lebih gampang diingat daripada fakta. Soalnya kita susah kalo nginget fakta-fakta doang apalagi kalo bentuknya angka. Tapi kalo dibungkus pake cerita, bisa lebih enak. Ini alasan kenapa banyak orang yang bisa hafal nama tokoh-tokoh Marvel, karena cinta sama ceritanya dulu. Cerita = fakta + konteks + emosi as Mas kita jalan2 ke Eropanya kapan?| Psikolog Jerome Bruner bilang, “stories are facts wrapped up in context and delivered with emotion”. Cerita itu fakta yang dibungkus sesuai konteksnya dan dibawain dengan emosi. Ini agak mirip cara DNVB yang kontennya mengandung emosi ... Powerful story is marketing gold Artikel “How Creating A Product Story Can Generate Sales” bilang, cerita yang menarik bisa jadi memorable plus sangat shareable. Ini alasan tiap kali Go-Jek ngerilis iklan, orang-orang suka ngeshare, karena kisahnya relate dan lucu. Go-Jek: rajanya viral, rajanya cerita ® Bee elic i] menunggu membaca main gitar cuci motor menulis nonton tv bengong ela €-l aE] tidur main game Source: PPT Kak TB, cara Go-Jek ngebreakdown suatu iklan Dari iklan #cerdikiawan sampai GoSend Instant Satu Jam, tim creative Go-jek selalu masukin unsur cerita ke dalamnya. Mulai dari cerita orang Indonesia yang selalu banyak #Agkak-akal buat ngesolve problem, juga cerita orang yang sering ngelakuin hal-hal aneh kalo lagi nunggu pesenan. [Cerita dari Subway...]",2688,28.0,https://scontent-iad3-2.cdninstagram.com/v/t51.2885-15/332021916_908658073613391_2722277180491011363_n.jpg?stp=dst-jpg_e35_p1080x1080&_nc_ht=scontent-iad3-2.cdninstagram.com&_nc_cat=103&_nc_ohc=4r2r70Mrm-AAX82GQZG&edm=APU89FABAAAA&ccb=7-5&oh=00_AfDGQJnvVT8MJcoD8EbUG4gBB_WPTaOLXs3M_76dlSLkhQ&oe=647CA363&_nc_sid=f4eaf9
2023-03-08 12:47:20,"Kok bisa ya iklan Go-Jek Ales lM ks) aU Lowe Belajar 3 rumus copywriting out of the box ala Creative Director Go-jek dOnvbo Marketing Series Copywriting: How to Write Advertisement that Sells Anatomi Copywriting yang Berhasil Eksekusi: Cara Riset & A/B Test Copywriting Cara Nulis Iklan yang Efektif & Memikat Manajemen Mood dan Kreativitas Manajemen Respon Netizen (Expecting the Expected) Monitor Efektivitas Copywriting Harga Case study (Good & Fail Pr Iza Examples) : MINGGU, 12 MARET 2023 mac) PUKUL 13.00 - 15.00 WIB aod Kadang Minbi Herrrar-heran sama Go-Jek. Kok bisa bikin iklan cakep terus. Ternyata setelah diselidiki sama KPK (Komisi Pencari Konten), tim creative mereka punya semacam rumus. er ee edge eels) Tubagustubitru Creative Director Creative labs Gojek Twitter: @tbputera email: thputera@gmail.com Dan rumus-rumus ini besok bakal dishare sama Kak TB di Gossip Forum yang ngebedah soal copywriting. Kalo menurut Kamus Oxford, copywriting bisa disebut “kegiatan atau pekerjaan menulis teks iklan atau materi publisitas”. Tapi karena orang creative Go-Jek pasti selalu out of the box, Kak TB punya penjelasan yang lebih simple. So, kata beliau ada 3 definisi copywriting: 1. Merayu pake kata-kata 2. Membujuk pake | kata-kata BILAMENEMUKAN [ff “ALAN -Buka Praktek : 07.00 - oe “Merayu, membujuk, menjual” Next slide kita bakal bahas 3 step kenapa ide semacam #Cerdikiawan bisa tercipta. #1 Rumus 5W1H? Kalo bagi kak TB rumus ini ga berlaku, terlalu boring ceunah. jadi kak TB bikin rumus baru, “KASIAN BAGINDA’”: Kenapa - Apa - Siapa - Kapan - Bagaimana - Di mana KASIAN BAGINDA @ Kenapa melakukan ini? B) Apa yang mau dicapai? C) Siapa yang mau di-target? D) Kapan akan tayang? E) Bagaimana caranya? F) Di mana tayangnya? #2 Insight: Tips ini yang bikin Go-Jek selalu berhasil bikin iklan yang viral dan relate sama orang Indo. Mereka selalu nyari “ide unik” (insight) dari kehidupan warga +62, terus insight ini diselipin Ke konsep iklannya. COTM (ditt (ep DCE Cm Talim acl adalah dengan kerokan — eR a, ni =f Dp a — be. < H UCeOr a EEN ai} SUC GAK ADA YANG MAU AMBIL #3 Pake bumbu tambahan Setelah dirumusin pake konsep KASIAN BAGINDA, terus masukin INSIGHT yang unik, kita bisa masukin salah satu dari empat “bumbu tambahan” biar copywritingnya makin cakep kayak mantan kamu: eee eae) Slang Plesetan Rima Perumpamaan Slide selanjutnya kita kasin contoh gimana cara pake bumbu penyedap rasa — Contoh copywriting yang pake RIMA Segala perkara dapat dituntaskan. Garpu pun jadi alat berbagi kesejukan. Tere emule tle Menyangga kepala jadi inspirasi bagi yang melirik. Yee Bate Ele tte rr eee Coe Lemelitl a Pres elas at) eae ec ee eet Ree ee Mereka menerobos semua permasalahan. Lepas tangan pun bisa telponan. Menakjubkan. Setiap hari mereka menyirami diri dengan gagasan. Terus melangkah dalam ruang gerak yang minimal. Melampaui batas dengan penuh akal. Pasti tahu kan ini iklan apa? Yap, betul, #cerdikiawan. Karena bumbunya pake rima, makanya Go-jek pake Mba Nana sebagai naratornya. Soalnya Mba kritis satu ini emang terkenal dengan bait-bait fAduAye rimanya. Nah, coba kita bahas contoh lainnya — [Gini loh rumusnya Gojek]",2760,43.0,https://scontent-iad3-1.cdninstagram.com/v/t51.2885-15/334256985_920935965616504_1912032756911875279_n.jpg?stp=dst-jpg_e35_p1080x1080&_nc_ht=scontent-iad3-1.cdninstagram.com&_nc_cat=104&_nc_ohc=DNlZeG8WQboAX-eqEfm&edm=APU89FABAAAA&ccb=7-5&oh=00_AfA1SxSxPtlOc22XB1RvaRG1WCqQRpqGtvBBX-_yYsA2UQ&oe=647C150F&_nc_sid=f4eaf9
2023-03-08 10:13:42,Ini cara biar tau marketing kamu works atau engga dnvb Marketing Series None None None None None None None None [baliho tapi kok gaada gambar? 🙈],552,4.0,https://scontent-iad3-2.cdninstagram.com/v/t51.2885-15/332906842_1571462100024936_8722637544955845629_n.jpg?stp=dst-jpg_e15_fr_p1080x1080&_nc_ht=scontent-iad3-2.cdninstagram.com&_nc_cat=100&_nc_ohc=uSB0cn6QCAgAX_qWR2n&edm=APU89FABAAAA&ccb=7-5&oh=00_AfB36tUvpE4XvNK5a89bfgMMKvChj4dB_FS9iGQ1ZkxxLA&oe=647929B8&_nc_sid=f4eaf9
